{
  "updatedAt": "2026-01-12T17:35:57.666Z",
  "items": [
    {
      "award": "Critics Choice Documentary Awards",
      "status": "Anúncio dos Indicados",
      "statusKey": "indicados",
      "date": "14/10/2025",
      "dateISO": "2025-10-14",
      "timestamp": 1760400000000,
      "hasDate": true,
      "imageUrl": "https://i.imgur.com/GZPhwz9.png",
      "newsUrl": "https://www.termometrooscar.com/cinema-eacute-tudo-isso---blog/apocalipse-nos-tropicos-documentario-de-petra-costa-sobre-o-fascismo-religioso-no-brasil-recebe-4-indicacoes-no-critics-choice-documentary-awards-2025",
      "pageUrl": "",
      "newsImageUrl": "https://www.termometrooscar.com/uploads/1/4/8/8/1488234/apocalipse-nos-tropicos-document_orig.jpg",
      "newsTitle": "\"Apocalipse nos Trópicos\", documentário de Petra Costa sobre o fascismo religioso no Brasil, recebe 4 indicações no Critic's Choice Documentary Awards 2025!",
      "slug": "critics-choice-documentary-awards"
    },
    {
      "award": "European Film Awards",
      "status": "Longlist",
      "statusKey": "outro",
      "date": "14/10/2025",
      "dateISO": "2025-10-14",
      "timestamp": 1760400000000,
      "hasDate": true,
      "imageUrl": "https://i.imgur.com/nSvp7jP.png",
      "newsUrl": "https://www.termometrooscar.com/cinema-eacute-tudo-isso---blog/com-titulos-como-valor-sentimental-bugonia-e-foi-apenas-um-acidente-o-european-film-awards-2026-divulga-longlist-com-44-filmes",
      "pageUrl": "",
      "newsImageUrl": "https://www.termometrooscar.com/uploads/1/4/8/8/1488234/bugoniamascha-smascmascha-schilinskiha-schilinskichilinski_orig.jpg",
      "newsTitle": "Com títulos como \"Valor Sentimental\", \"Bugonia\" e \"Foi Apenas Um Acidente\", o European Film Awards 2026 divulga longlist com 44 filmes!",
      "slug": "european-film-awards"
    },
    {
      "award": "Gotham Awards",
      "status": "Anúncio dos Indicados",
      "statusKey": "indicados",
      "date": "28/10/2025",
      "dateISO": "2025-10-28",
      "timestamp": 1761609600000,
      "hasDate": true,
      "imageUrl": "https://i.imgur.com/U4Kv44v.png",
      "newsUrl": "https://www.termometrooscar.com/cinema-eacute-tudo-isso---blog/wagner-moura-e-kleber-mendonca-filho-sao-indicados-ao-gotham-awards-2025-por-o-agente-secreto-uma-batalha-apos-a-outra-lidera-com-6-indicacoes",
      "pageUrl": "",
      "newsImageUrl": "https://www.termometrooscar.com/uploads/1/4/8/8/1488234/kleber-mendonca-filho-e-wagner-md3d3d3rfr_orig.jpg",
      "newsTitle": "Wagner Moura e Kleber Mendonça Filho são indicados ao Gotham Awards 2025 por \"O Agente Secreto\"! \"Uma Batalha Após a Outra\" lidera com 6 indicações!",
      "slug": "gotham-awards"
    },
    {
      "award": "Hollywood Music In Media Awards",
      "status": "Anúncio dos Indicados",
      "statusKey": "indicados",
      "date": "06/11/2025",
      "dateISO": "2025-11-06",
      "timestamp": 1762387200000,
      "hasDate": true,
      "imageUrl": "https://i.imgur.com/UpVhQFK.png",
      "newsUrl": "https://www.termometrooscar.com/cinema-eacute-tudo-isso---blog/wicked-parte-2-lidera-com-6-indicacoes-o-hollywood-music-in-media-awards-2025-a-premiacao-mais-completa-de-musica-para-cinema",
      "pageUrl": "",
      "newsImageUrl": "https://www.termometrooscar.com/uploads/1/4/8/8/1488234/published/wicked-for-good-ver4-xlghollywod-music.jpg?1762432832",
      "newsTitle": "\"Wicked - parte 2\" lidera com 6 indicações o Hollywood Music in Media Awards 2025, a premiação mais completa de música para cinema!",
      "slug": "hollywood-music-in-media-awards"
    },
    {
      "award": "Critics Choice Documentary Awards",
      "status": "Anúncio dos Vencedores",
      "statusKey": "vencedores",
      "date": "09/11/2025",
      "dateISO": "2025-11-09",
      "timestamp": 1762646400000,
      "hasDate": true,
      "imageUrl": "https://i.imgur.com/GZPhwz9.png",
      "newsUrl": "https://www.termometrooscar.com/cinema-eacute-tudo-isso---blog/a-vizinha-perfeita-vence-5-premios-incluindo-melhor-documentario-no-critics-choice-documentary-awards-2025",
      "pageUrl": "",
      "newsImageUrl": "https://www.termometrooscar.com/uploads/1/4/8/8/1488234/aaaaqrjfs1kkoyiak6nkfmvpry7zy8j8_orig.jpg",
      "newsTitle": "\"A Vizinha Perfeita\" vence 5 prêmios, incluindo Melhor Documentário, no Critic's Choice Documentary Awards 2025!",
      "slug": "critics-choice-documentary-awards"
    },
    {
      "award": "Cinema Eye Honors Awards",
      "status": "Anúncio dos Indicados",
      "statusKey": "indicados",
      "date": "13/11/2025",
      "dateISO": "2025-11-13",
      "timestamp": 1762992000000,
      "hasDate": true,
      "imageUrl": "https://i.imgur.com/foayYNY.png",
      "newsUrl": "https://www.termometrooscar.com/cinema-eacute-tudo-isso---blog/embaixo-da-luz-neon-sobre-duas-poetas-que-enfrentam-o-cancer-com-amor-e-parceria-inabalavel-lidera-com-6-indicacoes-o-cinema-eye-honors-2026",
      "pageUrl": "",
      "newsImageUrl": "https://www.termometrooscar.com/uploads/1/4/8/8/1488234/come-see-me-in-the-good-light-prcome-see-me-in-the-good-lightss_orig.jpg",
      "newsTitle": "\"Embaixo da Luz Neon\", sobre duas poetas que enfrentam o câncer com amor e parceria inabalável , lidera com 6 indicações o Cinema Eye Honors 2026!",
      "slug": "cinema-eye-honors-awards"
    },
    {
      "award": "European Film Awards",
      "status": "Anúncio dos Indicados",
      "statusKey": "indicados",
      "date": "18/11/2025",
      "dateISO": "2025-11-18",
      "timestamp": 1763424000000,
      "hasDate": true,
      "imageUrl": "https://i.imgur.com/nSvp7jP.png",
      "newsUrl": "https://www.termometrooscar.com/cinema-eacute-tudo-isso---blog/valor-sentimental-lidera-com-5-indicacoes-o-european-film-awards-2026",
      "pageUrl": "",
      "newsImageUrl": "https://www.termometrooscar.com/uploads/1/4/8/8/1488234/sentimental-value-10-valor-sentiemnal-2344_orig.jpg",
      "newsTitle": "\"Valor Sentimental\" lidera com 5 indicações o European Film Awards 2026!",
      "slug": "european-film-awards"
    },
    {
      "award": "IDA Documentary Awards",
      "status": "Anúncio dos Indicados",
      "statusKey": "indicados",
      "date": "18/11/2025",
      "dateISO": "2025-11-18",
      "timestamp": 1763424000000,
      "hasDate": true,
      "imageUrl": "https://i.imgur.com/RUaEZen.png",
      "newsUrl": "https://www.termometrooscar.com/cinema-eacute-tudo-isso---blog/apocalipse-nos-tropicos-documentario-de-petra-costa-sobre-o-fascismo-religioso-no-brasil-lidera-o-ida-awards-2025-com-4-indicacoes",
      "pageUrl": "",
      "newsImageUrl": "https://www.termometrooscar.com/uploads/1/4/8/8/1488234/aaaaqbprjecg5yeuwqus59odxsis3axo-apocaplisieie-12323_orig.jpg",
      "newsTitle": "\"Apocalipse nos Trópicos\", documentário de Petra Costa sobre o fascismo religioso no Brasil, lidera o IDA Awards 2025 com 4 indicações!",
      "slug": "ida-documentary-awards"
    },
    {
      "award": "Astra Creative Arts Awards (Hollywood Creative Alliance)",
      "status": "Anúncio dos Indicados",
      "statusKey": "indicados",
      "date": "19/11/2025",
      "dateISO": "2025-11-19",
      "timestamp": 1763510400000,
      "hasDate": true,
      "imageUrl": "https://i.imgur.com/7BrmYgM.png",
      "newsUrl": "https://www.termometrooscar.com/cinema-eacute-tudo-isso---blog/pecadores-lidera-as-categorias-tecnicas-do-astra-film-awards-com-11-indicacoes",
      "pageUrl": "",
      "newsImageUrl": "https://www.termometrooscar.com/uploads/1/4/8/8/1488234/sinners-movithe-2025-hollywood-creative-alliance-s-hca-astra-creative-arts-awardse_orig.jpg",
      "newsTitle": "\"Pecadores\" lidera as categorias técnicas do Astra Creative Arts Awards com 11 indicações!",
      "slug": "astra-creative-arts-awards-hollywood-creative-alliance"
    },
    {
      "award": "Hollywood Music In Media Awards",
      "status": "Anúncio dos Vencedores",
      "statusKey": "vencedores",
      "date": "19/11/2025",
      "dateISO": "2025-11-19",
      "timestamp": 1763510400000,
      "hasDate": true,
      "imageUrl": "https://i.imgur.com/UpVhQFK.png",
      "newsUrl": "https://www.termometrooscar.com/cinema-eacute-tudo-isso---blog/pecadores-vence-como-melhor-trilha-sonora-e-melhor-cancao-original-no-hollywood-music-in-media-awards-2025",
      "pageUrl": "",
      "newsImageUrl": "https://www.termometrooscar.com/uploads/1/4/8/8/1488234/published/sinne-rsinne-rnsi-nsinne-rnsi-nnsi-nsinne-rnsi-n.jpg?1763663778",
      "newsTitle": "\"Pecadores\" vence como Melhor Trilha Sonora e Melhor Canção Original no Hollywood Music in Media Awards 2025!",
      "slug": "hollywood-music-in-media-awards"
    },
    {
      "award": "Astra Film Awards (Hollywood Creative Alliance)",
      "status": "Anúncio dos Indicados",
      "statusKey": "indicados",
      "date": "25/11/2025",
      "dateISO": "2025-11-25",
      "timestamp": 1764028800000,
      "hasDate": true,
      "imageUrl": "https://i.imgur.com/7BrmYgM.png",
      "newsUrl": "https://www.termometrooscar.com/cinema-eacute-tudo-isso---blog/uma-batalha-apos-a-outra-lidera-o-astra-film-awards-com-11-indicacoes-e-wagner-moura-consegue-sua-primeira-indicacao-em-ator-em-drama-com-o-agente-secreto",
      "pageUrl": "",
      "newsImageUrl": "https://www.termometrooscar.com/uploads/1/4/8/8/1488234/ba2e8bb7-29b6-5156-b413-f146ea65_orig.jpg",
      "newsTitle": "\"Uma Batalha Após a Outra\" lidera o Astra Film Awards com 11 indicações, e Wagner Moura consegue sua primeira indicação em Ator em Drama com \"O Agente Secreto\"!",
      "slug": "astra-film-awards-hollywood-creative-alliance"
    },
    {
      "award": "Gotham Awards",
      "status": "Anúncio dos Vencedores",
      "statusKey": "vencedores",
      "date": "01/12/2025",
      "dateISO": "2025-12-01",
      "timestamp": 1764547200000,
      "hasDate": true,
      "imageUrl": "https://i.imgur.com/U4Kv44v.png",
      "newsUrl": "https://www.termometrooscar.com/cinema-eacute-tudo-isso---blog/uma-batalha-apos-a-outra-vence-como-melhor-filme-no-gotham-awards-2025",
      "pageUrl": "",
      "newsImageUrl": "https://www.termometrooscar.com/uploads/1/4/8/8/1488234/onebattle01ma-batalha-ap-s-a-outraence-como-melhor-filme-no-gotham-awards-2025_orig.jpg",
      "newsTitle": "\"Uma Batalha Após a Outra\" vence como Melhor Filme no Gotham Awards 2025!",
      "slug": "gotham-awards"
    },
    {
      "award": "New York Film Critics Circle Awards",
      "status": "Anúncio dos Vencedores",
      "statusKey": "vencedores",
      "date": "02/12/2025",
      "dateISO": "2025-12-02",
      "timestamp": 1764633600000,
      "hasDate": true,
      "imageUrl": "https://i.imgur.com/jYzawLd.png",
      "newsUrl": "https://www.termometrooscar.com/cinema-eacute-tudo-isso---blog/uma-batalha-apos-a-outra-vence-o-new-york-film-critics-circle-awards-2025-o-agente-secreto-vence-como-melhor-filme-internacional-e-wagner-moura-como-melhor-ator",
      "pageUrl": "",
      "newsImageUrl": "https://www.termometrooscar.com/uploads/1/4/8/8/1488234/copia-de-senhor-dos-aneis-3_orig.jpg",
      "newsTitle": "\"Uma Batalha Após a Outra\" vence o New York Film Critics Circle Awards 2025! \"O Agente Secreto\" vence como Melhor Filme Internacional e Wagner Moura como Melhor Ator!",
      "slug": "new-york-film-critics-circle-awards"
    },
    {
      "award": "Atlanta Film Critics Circle Awards",
      "status": "Anúncio dos Vencedores",
      "statusKey": "vencedores",
      "date": "03/12/2025",
      "dateISO": "2025-12-03",
      "timestamp": 1764720000000,
      "hasDate": true,
      "imageUrl": "https://i.imgur.com/z0ZRWAl.png",
      "newsUrl": "https://www.termometrooscar.com/cinema-eacute-tudo-isso---blog/uma-batalha-apos-a-outra-leva-uma-grande-vitoria-com-8-premios-incluindo-ator-para-leonardo-dicaprio-no-atlanta-film-critics-awards-2025",
      "pageUrl": "",
      "newsImageUrl": "https://www.termometrooscar.com/uploads/1/4/8/8/1488234/oneba-tle-naansosndfn3nnr293-atltnanta_orig.jpg",
      "newsTitle": "\"Uma Batalha Após a Outra\" leva uma grande vitória com 8 prêmios, incluindo ator para Leonardo DiCaprio, no Atlanta Film Critics Awards 2025!",
      "slug": "atlanta-film-critics-circle-awards"
    },
    {
      "award": "Independent Spirit Awards",
      "status": "Anúncio dos Indicados",
      "statusKey": "indicados",
      "date": "03/12/2025",
      "dateISO": "2025-12-03",
      "timestamp": 1764720000000,
      "hasDate": true,
      "imageUrl": "https://i.imgur.com/dxiMIY3.png",
      "newsUrl": "https://www.termometrooscar.com/cinema-eacute-tudo-isso---blog/o-dia-de-peter-hujar-lidera-com-5-indicacoes-no-independent-spirit-awards-2026-o-agente-secreto-volta-a-ser-indicado-como-filme-internacional",
      "pageUrl": "",
      "newsImageUrl": "https://www.termometrooscar.com/uploads/1/4/8/8/1488234/peter-hujars-day-still-1-jpg_orig.jpg",
      "newsTitle": "\"O Dia de Peter Hujar\" lidera com 5 indicações no Independent Spirit Awards 2026! \"O Agente Secreto\" volta a ser indicado como Filme Internacional!",
      "slug": "independent-spirit-awards"
    },
    {
      "award": "National Board of Review Awards",
      "status": "Anúncio dos Vencedores",
      "statusKey": "vencedores",
      "date": "03/12/2025",
      "dateISO": "2025-12-03",
      "timestamp": 1764720000000,
      "hasDate": true,
      "imageUrl": "https://i.imgur.com/OZDeSGi.png",
      "newsUrl": "https://www.termometrooscar.com/cinema-eacute-tudo-isso---blog/uma-batalha-apos-a-outra-vence-o-national-board-of-review-2025-com-leonardo-dicaprio-e-benicio-del-toro-sendo-premiados-outras-vez",
      "pageUrl": "",
      "newsImageUrl": "https://www.termometrooscar.com/uploads/1/4/8/8/1488234/g7lnzazxiaa3awtbenicio-del-torobenicio-del-torobenicio-del-toro_orig.jpg",
      "newsTitle": "\"Uma Batalha Após a Outra\" vence o National Board of Review 2025, com Leonardo DiCaprio e Benicio del Toro sendo premiados outras vez!",
      "slug": "national-board-of-review-awards"
    },
    {
      "award": "AFI Awards",
      "status": "Anúncio dos Vencedores",
      "statusKey": "vencedores",
      "date": "04/12/2025",
      "dateISO": "2025-12-04",
      "timestamp": 1764806400000,
      "hasDate": true,
      "imageUrl": "https://i.imgur.com/SsYPKLI.png",
      "newsUrl": "https://www.termometrooscar.com/cinema-eacute-tudo-isso---blog/com-pecadores-frankenstein-avatar-e-wicked-parte-2-o-afi-awards-2025-divulga-a-lista-com-os-10-melhores-filmes-do-ano",
      "pageUrl": "",
      "newsImageUrl": "https://www.termometrooscar.com/uploads/1/4/8/8/1488234/foto-afi-afi-afia-fi-afijet_orig.jpg",
      "newsTitle": "Com \"Pecadores\", \"Frankenstein\", \"Avatar\" e \"Wicked - parte 2\"... O AFI Awards 2025 divulga a lista com os 10 melhores filmes do ano!",
      "slug": "afi-awards"
    },
    {
      "award": "Critics Choice Movie Awards",
      "status": "Anúncio dos Indicados",
      "statusKey": "indicados",
      "date": "05/12/2025",
      "dateISO": "2025-12-05",
      "timestamp": 1764892800000,
      "hasDate": true,
      "imageUrl": "https://i.imgur.com/PbTVmdT.png",
      "newsUrl": "https://www.termometrooscar.com/cinema-eacute-tudo-isso---blog/wagner-moura-e-o-agente-secreto-sao-indicados-ao-critics-choice-awards-2026-pecadores-lidera-com-17-indicacoes",
      "pageUrl": "",
      "newsImageUrl": "https://www.termometrooscar.com/uploads/1/4/8/8/1488234/fotowagnerpecadores_orig.png",
      "newsTitle": "Wagner Moura e \"O Agente Secreto\" são indicados ao Critics' Choice Awards 2026! \"Pecadores\" lidera com 17 indicações!",
      "slug": "critics-choice-movie-awards"
    },
    {
      "award": "Michigan Movie Critics Guild Awards",
      "status": "Anúncio dos Indicados",
      "statusKey": "indicados",
      "date": "05/12/2025",
      "dateISO": "2025-12-05",
      "timestamp": 1764892800000,
      "hasDate": true,
      "imageUrl": "https://i.imgur.com/mSdISCh.png",
      "newsUrl": "https://www.termometrooscar.com/cinema-eacute-tudo-isso---blog/uma-batalha-apos-a-outra-lidera-com-12-indicacoes-no-michigan-movie-critics-guild-2025-rose-byrne-segue-crescendo-em-atriz-por-se-eu-tivesse-pernas-te-chutaria",
      "pageUrl": "",
      "newsImageUrl": "https://www.termometrooscar.com/uploads/1/4/8/8/1488234/legs02-photo-by-logan-whiera-com-12-indica-es-no-michigan-movie-critics-guild_orig.jpg",
      "newsTitle": "\"Uma Batalha Após a Outra\" lidera com 12 indicações no Michigan Movie Critics Guild 2025, Rose Byrne segue crescendo em Atriz por \"Se Eu Tivesse Pernas, Te Chutaria\"!",
      "slug": "michigan-movie-critics-guild-awards"
    },
    {
      "award": "Seattle Film Critics Society Awards",
      "status": "Anúncio dos Indicados",
      "statusKey": "indicados",
      "date": "05/12/2025",
      "dateISO": "2025-12-05",
      "timestamp": 1764892800000,
      "hasDate": true,
      "imageUrl": "https://i.imgur.com/ZA0K4to.png",
      "newsUrl": "https://www.termometrooscar.com/cinema-eacute-tudo-isso---blog/pecadores-lidera-com-14-indicacoes-no-seattle-film-critics-society-awards-2025-amy-madigan-recebe-dupla-indicacao-por-a-hora-do-mal",
      "pageUrl": "",
      "newsImageUrl": "https://www.termometrooscar.com/uploads/1/4/8/8/1488234/amy-madigan-weapons-092325-03-03_orig.jpg",
      "newsTitle": "\"Pecadores\" lidera com 14 indicações no Seattle Film Critics Society Awards 2025, Amy Madigan recebe dupla indicação por \"A Hora do Mal\"!",
      "slug": "seattle-film-critics-society-awards"
    },
    {
      "award": "IDA Documentary Awards",
      "status": "Anúncio dos Vencedores",
      "statusKey": "vencedores",
      "date": "06/12/2025",
      "dateISO": "2025-12-06",
      "timestamp": 1764979200000,
      "hasDate": true,
      "imageUrl": "https://i.imgur.com/RUaEZen.png",
      "newsUrl": "https://www.termometrooscar.com/cinema-eacute-tudo-isso---blog/the-tale-of-silyan-vence-como-melhor-documentario-no-ida-awards-2025-e-apocalipse-nos-tropicos-vence-os-premios-de-melhor-roteiro-e-melhor-producao",
      "pageUrl": "",
      "newsImageUrl": "https://www.termometrooscar.com/uploads/1/4/8/8/1488234/apocalipse-nos-tropicos-document-petra-ida-ida-diia-12_orig.jpg",
      "newsTitle": "\"The Tale of Silyan\" vence como Melhor Documentário no IDA Awards 2025, e \"Apocalipse nos Trópicos\" vence os prêmios de Melhor Roteiro e Melhor Produção!",
      "slug": "ida-documentary-awards"
    },
    {
      "award": "Washington DC Area Film Critics Association Awards",
      "status": "Anúncio dos Indicados",
      "statusKey": "indicados",
      "date": "06/12/2025",
      "dateISO": "2025-12-06",
      "timestamp": 1764979200000,
      "hasDate": true,
      "imageUrl": "https://i.imgur.com/P5fRdl9.png",
      "newsUrl": "https://www.termometrooscar.com/cinema-eacute-tudo-isso---blog/pecadores-e-uma-batalha-apos-a-outra-lideram-com-13-indicacoes-cada-no-washington-dc-area-film-critics-awards-2025",
      "pageUrl": "",
      "newsImageUrl": "https://www.termometrooscar.com/uploads/1/4/8/8/1488234/sinners-michael-b-jordansinenris-123_orig.jpg",
      "newsTitle": "\"Pecadores\" e \"Uma Batalha Após a Outra\" lideram com 13 indicações cada no Washington DC Area Film Critics Awards 2025!",
      "slug": "washington-dc-area-film-critics-association-awards"
    },
    {
      "award": "Los Angeles Film Critics Association Awards",
      "status": "Anúncio dos Vencedores",
      "statusKey": "vencedores",
      "date": "07/12/2025",
      "dateISO": "2025-12-07",
      "timestamp": 1765065600000,
      "hasDate": true,
      "imageUrl": "https://i.imgur.com/tXk30uf.png",
      "newsUrl": "https://www.termometrooscar.com/cinema-eacute-tudo-isso---blog/uma-batalha-apos-a-outra-vence-como-melhor-filme-no-los-angeles-film-critics-association-awards-2025-e-wagner-moura-e-segundo-em-melhor-atuacao-do-ano-mesma-indicacao-recebida-por-fernanda-torres-na-temporada-passada",
      "pageUrl": "",
      "newsImageUrl": "https://www.termometrooscar.com/uploads/1/4/8/8/1488234/wanenrnenennenenen-los-angelelelslle-leslels-23060697_orig.jpg",
      "newsTitle": "\"O Agente Secreto\" vence Melhor Filme Internacional e fica em segundo como Melhor Filme e Melhor Ator para Wagner Moura no Los Angeles Film Critics Association Awards 2025! \"Uma Batalha Após a Outra\" leva prêmio principal!",
      "slug": "los-angeles-film-critics-association-awards"
    },
    {
      "award": "St. Louis Film Critics Association Awards",
      "status": "Anúncio dos Indicados",
      "statusKey": "indicados",
      "date": "07/12/2025",
      "dateISO": "2025-12-07",
      "timestamp": 1765065600000,
      "hasDate": true,
      "imageUrl": "https://i.imgur.com/CUSRsk6.png",
      "newsUrl": "https://www.termometrooscar.com/cinema-eacute-tudo-isso---blog/uma-batalha-apos-a-outra-lidera-com-15-indicacoes-no-st-louis-film-critics-awards-2025-o-agente-secreto-e-indicado-a-melhor-filme-e-wicked-parte-2-e-esnobado-das-categorias-principais",
      "pageUrl": "",
      "newsImageUrl": "https://www.termometrooscar.com/uploads/1/4/8/8/1488234/fot-agente-screto-wickekdd123-ojet_orig.jpg",
      "newsTitle": "\"Uma Batalha Após a Outra\" lidera com 15 indicações no St. Louis Film Critics Awards 2025, \"O Agente Secreto\" é indicado a Melhor Filme, e \"Wicked - parte 2\" é esnobado das categorias principais!",
      "slug": "st-louis-film-critics-association-awards"
    },
    {
      "award": "Toronto Film Critics Association Awards",
      "status": "Anúncio dos Vencedores",
      "statusKey": "vencedores",
      "date": "07/12/2025",
      "dateISO": "2025-12-07",
      "timestamp": 1765065600000,
      "hasDate": true,
      "imageUrl": "https://i.imgur.com/SR4GCaw.png",
      "newsUrl": "https://www.termometrooscar.com/cinema-eacute-tudo-isso---blog/uma-batalha-apos-a-outra-vence-o-toronto-film-critics-association-awards-2025-ethan-hawke-vence-o-premio-de-melhor-atuacao-por-blue-moon",
      "pageUrl": "",
      "newsImageUrl": "https://www.termometrooscar.com/uploads/1/4/8/8/1488234/paul-thomas-anderson-one-battle-after-anotherpaul-thomas-anderson-one-battle-after-anotherpaul-thomas-anderson-one-battle-after-another_orig.jpg",
      "newsTitle": "\"Uma Batalha Após a Outra\" vence o Toronto Film Critics Association Awards 2025! Ethan Hawke vence o prêmio de Melhor Atuação por \"Blue Moon\"!",
      "slug": "toronto-film-critics-association-awards"
    },
    {
      "award": "Washington DC Area Film Critics Association Awards",
      "status": "Anúncio dos Vencedores",
      "statusKey": "vencedores",
      "date": "07/12/2025",
      "dateISO": "2025-12-07",
      "timestamp": 1765065600000,
      "hasDate": true,
      "imageUrl": "https://i.imgur.com/P5fRdl9.png",
      "newsUrl": "https://www.termometrooscar.com/cinema-eacute-tudo-isso---blog/pecadores-vence-como-melhor-filme-em-sua-primeira-grande-vitoria-que-inclui-michael-b-jordan-como-melhor-ator-no-washington-dc-area-film-critics-awards-2025",
      "pageUrl": "",
      "newsImageUrl": "https://www.termometrooscar.com/uploads/1/4/8/8/1488234/michale-bebebebbebbebe-jorndan-wahitisnin-123_orig.jpg",
      "newsTitle": "\"Pecadores\" vence como Melhor Filme em sua primeira grande vitória, que inclui Michael B. Jordan como Melhor Ator, no Washington DC Area Film Critics Awards 2025!",
      "slug": "washington-dc-area-film-critics-association-awards"
    },
    {
      "award": "African-American Film Critics Association Awards",
      "status": "Anúncio dos Vencedores",
      "statusKey": "vencedores",
      "date": "08/12/2025",
      "dateISO": "2025-12-08",
      "timestamp": 1765152000000,
      "hasDate": true,
      "imageUrl": "https://i.imgur.com/t15DGhA.png",
      "newsUrl": "https://www.termometrooscar.com/cinema-eacute-tudo-isso---blog/pecadores-vence-como-melhor-filme-no-african-american-film-critics-awards-2025",
      "pageUrl": "",
      "newsImageUrl": "https://www.termometrooscar.com/uploads/1/4/8/8/1488234/screenshot-2025-05-28-at-12-33-4sinnnners223_orig.jpg",
      "newsTitle": "\"Pecadores\" vence como Melhor Filme no African American Film Critics Awards 2025!",
      "slug": "african-american-film-critics-association-awards"
    },
    {
      "award": "Globo de Ouro",
      "status": "Anúncio dos Indicados",
      "statusKey": "indicados",
      "date": "08/12/2025",
      "dateISO": "2025-12-08",
      "timestamp": 1765152000000,
      "hasDate": true,
      "imageUrl": "https://i.imgur.com/Xu9KJaq.png",
      "newsUrl": "https://www.termometrooscar.com/cinema-eacute-tudo-isso---blog/wagner-moura-e-indicado-ao-globo-de-ouro-2026-com-o-agente-secreto-indicado-a-melhor-filme-em-drama-uma-batalha-apos-a-outra-lidera-com-9-indicacoes",
      "pageUrl": "",
      "newsImageUrl": "https://www.termometrooscar.com/uploads/1/4/8/8/1488234/o-agente-secreto-filme-wagner-momelhor-dire-o_orig.jpg",
      "newsTitle": "Wagner Moura é indicado ao Globo de Ouro 2026, com \"O Agente Secreto\" indicado a Melhor Filme em Drama! \"Uma Batalha Após a Outra\" lidera com 9 indicações!",
      "slug": "globo-de-ouro"
    },
    {
      "award": "Indiana Film Journalists Association Awards",
      "status": "Anúncio dos Indicados",
      "statusKey": "indicados",
      "date": "08/12/2025",
      "dateISO": "2025-12-08",
      "timestamp": 1765152000000,
      "hasDate": true,
      "imageUrl": "https://i.imgur.com/eoyDi1V.png",
      "newsUrl": "https://www.termometrooscar.com/cinema-eacute-tudo-isso---blog/uma-batalha-apos-a-outra-lidera-com-15-indicacoes-o-indiana-film-journalists-association-awards-2025-wicked-parte-2-e-completamente-esnobado-e-superman-se-destaca-com-8-indicacoes",
      "pageUrl": "",
      "newsImageUrl": "https://www.termometrooscar.com/uploads/1/4/8/8/1488234/superman-ganha-novas-imagens-ofi_orig.jpg",
      "newsTitle": "\"Uma Batalha Após a Outra\" lidera com 15 indicações o Indiana Film Journalists Association Awards 2025! \"Wicked - parte 2\" é completamente esnobado e \"Superman\" se destaca com 8 indicações!",
      "slug": "indiana-film-journalists-association-awards"
    },
    {
      "award": "Michigan Movie Critics Guild Awards",
      "status": "Anúncio dos Vencedores",
      "statusKey": "vencedores",
      "date": "08/12/2025",
      "dateISO": "2025-12-08",
      "timestamp": 1765152000000,
      "hasDate": true,
      "imageUrl": "https://i.imgur.com/mSdISCh.png",
      "newsUrl": "https://www.termometrooscar.com/cinema-eacute-tudo-isso---blog/pecadores-vence-como-melhor-filme-e-jessie-buckley-e-melhor-atriz-por-hamnet-no-michigan-movie-critics-guild-2025",
      "pageUrl": "",
      "newsImageUrl": "https://www.termometrooscar.com/uploads/1/4/8/8/1488234/95fc5810-23bb-4ed2-a4d5-bb3b39e45883_orig.jpg",
      "newsTitle": "\"Pecadores\" vence como Melhor Filme e Jessie Buckley é Melhor Atriz por \"Hamnet\" no Michigan Movie Critics Guild 2025!",
      "slug": "michigan-movie-critics-guild-awards"
    },
    {
      "award": "New York Film Critics Online Awards",
      "status": "Anúncio dos Indicados",
      "statusKey": "indicados",
      "date": "08/12/2025",
      "dateISO": "2025-12-08",
      "timestamp": 1765152000000,
      "hasDate": true,
      "imageUrl": "https://i.imgur.com/Ed86jrY.png",
      "newsUrl": "https://www.termometrooscar.com/cinema-eacute-tudo-isso---blog/uma-batalha-apos-a-outra-lidera-o-new-york-film-critics-online-awards-2025-sydney-sweeney-tem-sua-primeira-indicacao-em-atriz-por-christy",
      "pageUrl": "",
      "newsImageUrl": "https://www.termometrooscar.com/uploads/1/4/8/8/1488234/g5igliea8aapginsydney-sweeneysydney-sweeneysydney-sweeney_orig.jpg",
      "newsTitle": "\"Uma Batalha Após a Outra\" lidera o New York Film Critics Online Awards 2025! Sydney Sweeney tem sua primeira indicação em Atriz por \"Christy\"!",
      "slug": "new-york-film-critics-online-awards"
    },
    {
      "award": "Chicago Film Critics Association Awards",
      "status": "Anúncio dos Indicados",
      "statusKey": "indicados",
      "date": "09/12/2025",
      "dateISO": "2025-12-09",
      "timestamp": 1765238400000,
      "hasDate": true,
      "imageUrl": "https://i.imgur.com/N8F0SXm.png",
      "newsUrl": "https://www.termometrooscar.com/cinema-eacute-tudo-isso---blog/wagner-moura-e-indicado-em-melhor-ator-no-chicago-film-critics-association-awards-2025-pecadores-e-uma-batalha-apos-a-outra-empatam-com-12-indicacoes",
      "pageUrl": "",
      "newsImageUrl": "https://www.termometrooscar.com/uploads/1/4/8/8/1488234/o-agente-secreto-e-indicado-a-magente-screto_orig.jpg",
      "newsTitle": "Wagner Moura é indicado em Melhor Ator no Chicago Film Critics Association Awards 2025! \"Pecadores\" e \"Uma Batalha Após a Outra\" empatam com 12 indicações!",
      "slug": "chicago-film-critics-association-awards"
    },
    {
      "award": "Producers Guild of America Awards",
      "status": "Anúncio dos Indicados (Doc)",
      "statusKey": "indicados",
      "date": "09/12/2025",
      "dateISO": "2025-12-09",
      "timestamp": 1765238400000,
      "hasDate": true,
      "imageUrl": "https://i.imgur.com/S8SzYV8.png",
      "newsUrl": "https://www.termometrooscar.com/cinema-eacute-tudo-isso---blog/com-alguns-titulos-muito-comentados-como-a-vizinha-perfeita-conheca-os-indicados-ao-producers-guild-of-america-documentary-awards-2026",
      "pageUrl": "",
      "newsImageUrl": "https://www.termometrooscar.com/uploads/1/4/8/8/1488234/mv5bmdbkntg5mdyty2fkys00zwmxlwe13457_orig.jpg",
      "newsTitle": "Com alguns títulos muito comentados como \"A Vizinha Perfeita\"... Conheça os indicados ao Producers Guild of America Documentary Awards 2026!",
      "slug": "producers-guild-of-america-awards"
    },
    {
      "award": "Austin Film Critics Association Awards",
      "status": "Anúncio dos Indicados",
      "statusKey": "indicados",
      "date": "10/12/2025",
      "dateISO": "2025-12-10",
      "timestamp": 1765324800000,
      "hasDate": true,
      "imageUrl": "https://i.imgur.com/9yE122I.png",
      "newsUrl": "https://www.termometrooscar.com/cinema-eacute-tudo-isso---blog/o-agente-secreto-e-indicado-a-filme-filme-internacional-roteiro-e-ator-para-wagner-moura-no-austin-film-critics-awards-2025-e-uma-batalha-apos-a-outra-lidera-com-12-indicacoes",
      "pageUrl": "",
      "newsImageUrl": "https://www.termometrooscar.com/uploads/1/4/8/8/1488234/113254902-wagner-moura-em-o-agen-1234567_orig.jpg",
      "newsTitle": "\"O Agente Secreto\" é indicado a Filme, Filme Internacional, Roteiro e Ator para Wagner Moura no Austin Film Critics Awards 2025, e \"Uma Batalha Após a Outra\" lidera com 12 indicações!",
      "slug": "austin-film-critics-association-awards"
    },
    {
      "award": "Phoenix Critics Circle Awards",
      "status": "Anúncio dos Indicados",
      "statusKey": "indicados",
      "date": "10/12/2025",
      "dateISO": "2025-12-10",
      "timestamp": 1765324800000,
      "hasDate": true,
      "imageUrl": "https://i.imgur.com/g94KeF7.png",
      "newsUrl": "https://www.termometrooscar.com/cinema-eacute-tudo-isso---blog/uma-batalha-apos-a-outra-lidera-o-phoenix-critic-circle-awards-2025-jennifer-lawrence-volta-a-ser-indicada-em-atriz-por-morra-amor",
      "pageUrl": "",
      "newsImageUrl": "https://www.termometrooscar.com/uploads/1/4/8/8/1488234/die-my-love-movie-review-die-my-vleoeoo3045_orig.jpg",
      "newsTitle": "\"Uma Batalha Após a Outra\" lidera o Phoenix Critic Circle Awards 2025! Jennifer Lawrence volta a ser indicada em Atriz por \"Morra, Amor\"!",
      "slug": "phoenix-critics-circle-awards"
    },
    {
      "award": "Astra Creative Arts Awards (Hollywood Creative Alliance)",
      "status": "Anúncio dos Vencedores",
      "statusKey": "vencedores",
      "date": "11/12/2025",
      "dateISO": "2025-12-11",
      "timestamp": 1765411200000,
      "hasDate": true,
      "imageUrl": "https://i.imgur.com/7BrmYgM.png",
      "newsUrl": "https://www.termometrooscar.com/cinema-eacute-tudo-isso---blog/frankenstein-e-pecadores-lideram-com-3-vitorias-cada-o-astra-creative-arts-awards",
      "pageUrl": "",
      "newsImageUrl": "https://www.termometrooscar.com/uploads/1/4/8/8/1488234/guillermo-del-toro-frankenstein-astrart-394050_orig.jpg",
      "newsTitle": "\"Frankenstein\" e \"Pecadores\" lideram com 3 vitórias cada o Astra Creative Arts Awards!",
      "slug": "astra-creative-arts-awards-hollywood-creative-alliance"
    },
    {
      "award": "Chicago Film Critics Association Awards",
      "status": "Anúncio dos Vencedores",
      "statusKey": "vencedores",
      "date": "11/12/2025",
      "dateISO": "2025-12-11",
      "timestamp": 1765411200000,
      "hasDate": true,
      "imageUrl": "https://i.imgur.com/N8F0SXm.png",
      "newsUrl": "https://www.termometrooscar.com/cinema-eacute-tudo-isso---blog/uma-batalha-apos-a-outra-vence-como-melhor-filme-em-outra-grande-vitoria-com-9-premios-no-chicago-film-critics-association-awards-2025",
      "pageUrl": "",
      "newsImageUrl": "https://www.termometrooscar.com/uploads/1/4/8/8/1488234/g7qn3ouw4aerat5one-battle-after-anotherone-battle-after-another_orig.jpg",
      "newsTitle": "\"Uma Batalha Após a Outra\" vence como Melhor Filme em outra grande vitória com 9 prêmios no Chicago Film Critics Association Awards 2025!",
      "slug": "chicago-film-critics-association-awards"
    },
    {
      "award": "Phoenix Critics Circle Awards",
      "status": "Anúncio dos Vencedores",
      "statusKey": "vencedores",
      "date": "11/12/2025",
      "dateISO": "2025-12-11",
      "timestamp": 1765411200000,
      "hasDate": true,
      "imageUrl": "https://i.imgur.com/g94KeF7.png",
      "newsUrl": "https://www.termometrooscar.com/cinema-eacute-tudo-isso---blog/uma-batalha-apos-a-outra-vence-como-melhor-filme-e-timothee-chalamet-e-melhor-ator-por-marty-supreme-no-phoenix-critics-circle-awards-2025",
      "pageUrl": "",
      "newsImageUrl": "https://www.termometrooscar.com/uploads/1/4/8/8/1488234/79d42ed5-d556-4062-a047-413708d87840_orig.jpg",
      "newsTitle": "\"Uma Batalha Após a Outra\" vence como Melhor Filme, e Timothée Chalamet é Melhor Ator por \"Marty Supreme\", no Phoenix Critics Circle Awards 2025!",
      "slug": "phoenix-critics-circle-awards"
    },
    {
      "award": "Costume Designers Guild Awards",
      "status": "Anúncio dos Indicados",
      "statusKey": "indicados",
      "date": "12/12/2025",
      "dateISO": "2025-12-12",
      "timestamp": 1765497600000,
      "hasDate": true,
      "imageUrl": "https://i.imgur.com/goLNvdg.png",
      "newsUrl": "https://www.termometrooscar.com/cinema-eacute-tudo-isso---blog/wicked-parte-2-f1-frankenstein-confira-os-indicados-ao-costume-designers-guild-awards-2026-a-premiacao-do-sindicato-dos-figurinistas",
      "pageUrl": "",
      "newsImageUrl": "https://www.termometrooscar.com/uploads/1/4/8/8/1488234/costum-desigininan-f1-wicked-jet_orig.jpg",
      "newsTitle": "\"Wicked - parte 2\", \"F1\", \"Frankenstein\"... Confira os indicados ao Costume Designers Guild Awards 2026, a premiação do Sindicato dos Figurinistas!",
      "slug": "costume-designers-guild-awards"
    },
    {
      "award": "San Francisco Bay Area Film Critics Circle Awards",
      "status": "Anúncio dos Indicados",
      "statusKey": "indicados",
      "date": "12/12/2025",
      "dateISO": "2025-12-12",
      "timestamp": 1765497600000,
      "hasDate": true,
      "imageUrl": "https://i.imgur.com/X4fsAIK.png",
      "newsUrl": "https://www.termometrooscar.com/cinema-eacute-tudo-isso---blog/uma-batalha-apos-a-outra-lidera-as-indicacoes-do-san-francisco-bay-area-film-critics-circle-awards-2025-e-o-agente-secreto-e-mais-uma-vez-indicado-em-ator-para-wagner-moura",
      "pageUrl": "",
      "newsImageUrl": "https://www.termometrooscar.com/uploads/1/4/8/8/1488234/published/tngyovwjxvdl5ozavbncgc3m54hamnethamne5thamnethamnethamnet.jpg?1765651020",
      "newsTitle": "\"Uma Batalha Após a Outra\" lidera as indicações do San Francisco Bay Area Film Critics Circle Awards 2025, e \"O Agente Secreto\" é mais uma vez indicado em Ator para Wagner Moura!",
      "slug": "san-francisco-bay-area-film-critics-circle-awards"
    },
    {
      "award": "San Diego Film Critics Society Awards",
      "status": "Anúncio dos Indicados",
      "statusKey": "indicados",
      "date": "14/12/2025",
      "dateISO": "2025-12-14",
      "timestamp": 1765670400000,
      "hasDate": true,
      "imageUrl": "https://i.imgur.com/bQIvzjr.png",
      "newsUrl": "https://www.termometrooscar.com/cinema-eacute-tudo-isso---blog/pecadores-lidera-com-12-indicacoes-o-san-diego-film-critics-society-awards-2025-wagner-moura-e-indicado-em-ator-por-o-agente-secreto",
      "pageUrl": "",
      "newsImageUrl": "https://www.termometrooscar.com/uploads/1/4/8/8/1488234/published/agentetennetee-secrtut-ti-123-46-8-9-9-9-90.jpg?1765723584",
      "newsTitle": "\"Pecadores\" lidera com 12 indicações o San Diego Film Critics Society Awards 2025, Wagner Moura é indicado em Ator por \"O Agente Secreto\"!",
      "slug": "san-diego-film-critics-society-awards"
    },
    {
      "award": "San Francisco Bay Area Film Critics Circle Awards",
      "status": "Anúncio dos Vencedores",
      "statusKey": "vencedores",
      "date": "14/12/2025",
      "dateISO": "2025-12-14",
      "timestamp": 1765670400000,
      "hasDate": true,
      "imageUrl": "https://i.imgur.com/X4fsAIK.png",
      "newsUrl": "https://www.termometrooscar.com/cinema-eacute-tudo-isso---blog/uma-batalha-apos-a-outra-vence-como-melhor-filme-com-benicio-del-toro-vencendo-como-ator-coadjuvante-no-san-francisco-bay-area-film-critics-circle-awards-2025",
      "pageUrl": "",
      "newsImageUrl": "https://www.termometrooscar.com/uploads/1/4/8/8/1488234/published/one-battle-after-another-ver6-xl.jpg?1765804957",
      "newsTitle": "\"Uma Batalha Após a Outra\" vence como Melhor Filme com Benicio del Toro vencendo como Ator Coadjuvante no San Francisco Bay Area Film Critics Circle Awards 2025!",
      "slug": "san-francisco-bay-area-film-critics-circle-awards"
    },
    {
      "award": "St. Louis Film Critics Association Awards",
      "status": "Anúncio dos Vencedores",
      "statusKey": "vencedores",
      "date": "14/12/2025",
      "dateISO": "2025-12-14",
      "timestamp": 1765670400000,
      "hasDate": true,
      "imageUrl": "https://i.imgur.com/CUSRsk6.png",
      "newsUrl": "https://www.termometrooscar.com/cinema-eacute-tudo-isso---blog/uma-batalha-apos-a-outra-vence-como-melhor-filme-e-a-hora-do-mal-como-melhor-terror-no-st-louis-film-critics-awards-2025",
      "pageUrl": "",
      "newsImageUrl": "https://www.termometrooscar.com/uploads/1/4/8/8/1488234/published/07cul-weapons-review-kqgv-videos.jpg?1765815739",
      "newsTitle": "\"Uma Batalha Após a Outra\" vence como Melhor Filme e \"A Hora do Mal\" como Melhor Terror no St. Louis Film Critics Awards 2025!",
      "slug": "st-louis-film-critics-association-awards"
    },
    {
      "award": "Indiana Film Journalists Association Awards",
      "status": "Anúncio dos Vencedores",
      "statusKey": "vencedores",
      "date": "15/12/2025",
      "dateISO": "2025-12-15",
      "timestamp": 1765756800000,
      "hasDate": true,
      "imageUrl": "https://i.imgur.com/eoyDi1V.png",
      "newsUrl": "https://www.termometrooscar.com/cinema-eacute-tudo-isso---blog/pecadores-tem-uma-grande-vitoria-com-6-premios-incluindo-melhor-filme-e-melhor-elenco-no-indiana-film-journalists-association-awards-2025",
      "pageUrl": "",
      "newsImageUrl": "https://www.termometrooscar.com/uploads/1/4/8/8/1488234/published/sinners-ver31-xlgindiana-film-journalists-association-awardsindiana-film-journalists-association-awards.jpg?1765896245",
      "newsTitle": "\"Pecadores\" tem uma grande vitória com 6 prêmios, incluindo Melhor Filme e Melhor Elenco, no Indiana Film Journalists Association Awards 2025!",
      "slug": "indiana-film-journalists-association-awards"
    },
    {
      "award": "Kansas City Film Critics Circle Awards",
      "status": "Anúncio dos Indicados",
      "statusKey": "indicados",
      "date": "15/12/2025",
      "dateISO": "2025-12-15",
      "timestamp": 1765756800000,
      "hasDate": true,
      "imageUrl": "https://i.imgur.com/Vlse6YN.png",
      "newsUrl": "https://www.termometrooscar.com/cinema-eacute-tudo-isso---blog/vivo-ou-morto-um-misterio-knives-out-se-destaca-entre-os-lideres-de-indicacoes-no-kansas-city-film-critics-circle-awards-2025",
      "pageUrl": "",
      "newsImageUrl": "https://www.termometrooscar.com/uploads/1/4/8/8/1488234/published/aaaabujpdkfo4txbfwlfuytm7rcff2un.jpg?1765976078",
      "newsTitle": "\"Vivo ou Morto: Um Mistério Knives Out\" se destaca entre os líderes de indicações no Kansas City Film Critics Circle Awards 2025!",
      "slug": "kansas-city-film-critics-circle-awards"
    },
    {
      "award": "Las Vegas Film Critics Society Awards",
      "status": "Anúncio dos Indicados",
      "statusKey": "indicados",
      "date": "15/12/2025",
      "dateISO": "2025-12-15",
      "timestamp": 1765756800000,
      "hasDate": true,
      "imageUrl": "https://i.imgur.com/Vjl6gZw.png",
      "newsUrl": "https://www.termometrooscar.com/cinema-eacute-tudo-isso---blog/pecadores-lidera-com-14-indicacoes-no-las-vegas-film-critics-society-awards-2025",
      "pageUrl": "",
      "newsImageUrl": "https://www.termometrooscar.com/uploads/1/4/8/8/1488234/sinners-movie-reviewfrankensteinfrankensteinfrankensteinfrankensteinfrankenstein345_orig.jpg",
      "newsTitle": "\"Pecadores\" lidera com 14 indicações no Las Vegas Film Critics Society Awards 2025!",
      "slug": "las-vegas-film-critics-society-awards"
    },
    {
      "award": "London Film Critics Circle Awards",
      "status": "Anúncio dos Indicados",
      "statusKey": "indicados",
      "date": "15/12/2025",
      "dateISO": "2025-12-15",
      "timestamp": 1765756800000,
      "hasDate": true,
      "imageUrl": "https://i.imgur.com/5BeeUOq.png",
      "newsUrl": "https://www.termometrooscar.com/cinema-eacute-tudo-isso---blog/uma-batalha-apos-a-outra-lidera-o-london-critics-circle-film-awards-2025-e-jessie-buckley-recebe-dupla-indicacao-por-hamnet",
      "pageUrl": "",
      "newsImageUrl": "https://www.termometrooscar.com/uploads/1/4/8/8/1488234/hamnethamnethamnet1234hamnethamnetha890-mnetha-mnet_orig.jpg",
      "newsTitle": "\"Uma Batalha Após a Outra\" lidera o London Critics’ Circle Film Awards 2025, e Jessie Buckley recebe dupla indicação por \"Hamnet\"!",
      "slug": "london-film-critics-circle-awards"
    },
    {
      "award": "New York Film Critics Online Awards",
      "status": "Anúncio dos Vencedores",
      "statusKey": "vencedores",
      "date": "15/12/2025",
      "dateISO": "2025-12-15",
      "timestamp": 1765756800000,
      "hasDate": true,
      "imageUrl": "https://i.imgur.com/Ed86jrY.png",
      "newsUrl": "https://www.termometrooscar.com/cinema-eacute-tudo-isso---blog/uma-batalha-apos-a-outra-vence-como-melhor-filme-no-new-york-film-critics-online-awards-2025-jacob-elordi-vencen-como-ator-coadjuvante-por-frankenstein",
      "pageUrl": "",
      "newsImageUrl": "https://www.termometrooscar.com/uploads/1/4/8/8/1488234/1ca215c70eab25033272f1a14e99d044_orig.jpg",
      "newsTitle": "\"Uma Batalha Após a Outra\" vence como Melhor Filme no New York Film Critics Online Awards 2025! Jacob Elordi vence como Ator Coadjuvante por \"Frankenstein\"!",
      "slug": "new-york-film-critics-online-awards"
    },
    {
      "award": "Phoenix Film Critics Society Awards",
      "status": "Anúncio dos Vencedores",
      "statusKey": "vencedores",
      "date": "15/12/2025",
      "dateISO": "2025-12-15",
      "timestamp": 1765756800000,
      "hasDate": true,
      "imageUrl": "https://i.imgur.com/MeAiphC.png",
      "newsUrl": "https://www.termometrooscar.com/cinema-eacute-tudo-isso---blog/uma-batalha-apos-a-outra-vence-como-melhor-filme-e-entrega-premios-para-4-dos-seus-atores-incluindo-sean-penn-como-ator-coadjuvante-no-phoenix-film-critics-society-awards-2025",
      "pageUrl": "",
      "newsImageUrl": "https://www.termometrooscar.com/uploads/1/4/8/8/1488234/sena-pen-brutalistdo-melhor-ator-para-ralph-fiennes-no-phoenix-film-critics-society-awards-2024_orig.jpg",
      "newsTitle": "\"Uma Batalha Após a Outra\" vence como Melhor Filme e entrega prêmios para 4 dos seus atores, incluindo Sean Penn como Ator Coadjuvante, no Phoenix Film Critics Society Awards 2025!",
      "slug": "phoenix-film-critics-society-awards"
    },
    {
      "award": "San Diego Film Critics Society Awards",
      "status": "Anúncio dos Vencedores",
      "statusKey": "vencedores",
      "date": "15/12/2025",
      "dateISO": "2025-12-15",
      "timestamp": 1765756800000,
      "hasDate": true,
      "imageUrl": "https://i.imgur.com/bQIvzjr.png",
      "newsUrl": "https://www.termometrooscar.com/cinema-eacute-tudo-isso---blog/pecadores-vence-como-melhor-filme-e-melhor-ator-para-michael-b-jordan-no-san-diego-film-critics-society-awards-2025",
      "pageUrl": "",
      "newsImageUrl": "https://www.termometrooscar.com/uploads/1/4/8/8/1488234/g7ven4yxcaax89wa-associa-o-de-cr-ticos-de-san-diego-entregou-os-seu-pr-mios-finalizando-um-dia-com-muitas-premia-es_orig.jpg",
      "newsTitle": "\"Pecadores\" vence como Melhor Filme e Melhor Ator para Michael B. Jordan no San Diego Film Critics Society Awards 2025!",
      "slug": "san-diego-film-critics-society-awards"
    },
    {
      "award": "Seattle Film Critics Society Awards",
      "status": "Anúncio dos Vencedores",
      "statusKey": "vencedores",
      "date": "15/12/2025",
      "dateISO": "2025-12-15",
      "timestamp": 1765756800000,
      "hasDate": true,
      "imageUrl": "https://i.imgur.com/ZA0K4to.png",
      "newsUrl": "https://www.termometrooscar.com/cinema-eacute-tudo-isso---blog/uma-batalha-apos-a-outra-vence-como-melhor-filme-no-seattle-film-critics-awards-2025-gladys-de-a-hora-do-mal-e-eleita-como-melhor-vilao-do-ano",
      "pageUrl": "",
      "newsImageUrl": "https://www.termometrooscar.com/uploads/1/4/8/8/1488234/g5v3jkyxyaanw8iglay-dlsus-weaposn-123_orig.jpg",
      "newsTitle": "\"Uma Batalha Após a Outra\" vence como Melhor Filme no Seattle Film Critics Awards 2025! Gladys, de \"A Hora do Mal\", é eleita como Melhor Vilão do Ano!",
      "slug": "seattle-film-critics-society-awards"
    },
    {
      "award": "Southeastern Film Critics Association Awards",
      "status": "Anúncio dos Vencedores",
      "statusKey": "vencedores",
      "date": "15/12/2025",
      "dateISO": "2025-12-15",
      "timestamp": 1765756800000,
      "hasDate": true,
      "imageUrl": "https://i.imgur.com/90pNizH.png",
      "newsUrl": "https://www.termometrooscar.com/cinema-eacute-tudo-isso---blog/uma-batalha-vence-como-melhor-filme-pecadores-vence-mais-premios-e-o-agente-secreto-entra-na-lista-de-melhores-filmes-do-ano-no-southeastern-film-critics-association-awards-2025",
      "pageUrl": "",
      "newsImageUrl": "https://www.termometrooscar.com/uploads/1/4/8/8/1488234/f-epcdooe-s-leo-wangerotojet_orig.jpg",
      "newsTitle": "\"Uma Batalha Após a Outra\" vence como Melhor Filme, \"Pecadores\" vence mais prêmios e \"O Agente Secreto\" entra na lista de Melhores Filmes do Ano no Southeastern Film Critics Association Awards 2025!",
      "slug": "southeastern-film-critics-association-awards"
    },
    {
      "award": "USC Scripter Awards",
      "status": "Anúncio dos Indicados",
      "statusKey": "indicados",
      "date": "15/12/2025",
      "dateISO": "2025-12-15",
      "timestamp": 1765756800000,
      "hasDate": true,
      "imageUrl": "https://i.imgur.com/EE9Ccfh.png",
      "newsUrl": "https://www.termometrooscar.com/cinema-eacute-tudo-isso---blog/frankenstein-sonhos-de-trem-hamnet-veja-os-indicados-ao-usc-scripter-awards-2026-a-premiacao-que-se-tornou-o-maior-termometro-para-a-categoria-de-roteiro-adaptado",
      "pageUrl": "",
      "newsImageUrl": "https://www.termometrooscar.com/uploads/1/4/8/8/1488234/train-dreams-u-00-19-06-13-r-e17_orig.jpg",
      "newsTitle": "\"Frankenstein\", \"Sonhos de Trem\", \"Hamnet\"... Veja os indicados ao USC Scripter Awards 2026, a premiação que se tornou o maior termômetro para a categoria de Roteiro Adaptado!",
      "slug": "usc-scripter-awards"
    },
    {
      "award": "Florida Film Critics Circle Awards",
      "status": "Anúncio dos Indicados",
      "statusKey": "indicados",
      "date": "16/12/2025",
      "dateISO": "2025-12-16",
      "timestamp": 1765843200000,
      "hasDate": true,
      "imageUrl": "https://i.imgur.com/DlYPHss.png",
      "newsUrl": "https://www.termometrooscar.com/cinema-eacute-tudo-isso---blog/o-agente-secreto-recebe-4-indicacoes-no-florida-film-critics-circle-awards-2025-incluindo-melhor-direcao-de-arte-e-melhor-ator-para-wagner-moura",
      "pageUrl": "",
      "newsImageUrl": "https://www.termometrooscar.com/uploads/1/4/8/8/1488234/published/g8yhvb2x0aafwi1florida-film-critics-circle-awards-2025.jpg?1765981236",
      "newsTitle": "\"O Agente Secreto\" recebe 4 indicações no Florida Film Critics Circle Awards 2025, incluindo Melhor Direção de Arte e Melhor Ator para Wagner Moura!",
      "slug": "florida-film-critics-circle-awards"
    },
    {
      "award": "Oscar",
      "status": "Shortlist",
      "statusKey": "outro",
      "date": "16/12/2025",
      "dateISO": "2025-12-16",
      "timestamp": 1765843200000,
      "hasDate": true,
      "imageUrl": "https://i.imgur.com/guBEPZm.png",
      "newsUrl": "",
      "pageUrl": "",
      "newsImageUrl": "",
      "newsTitle": "",
      "slug": "oscar"
    },
    {
      "award": "Prêmio Exclamação",
      "status": "Início da votação aberta de nomeação",
      "statusKey": "outro",
      "date": "16/12/2025",
      "dateISO": "2025-12-16",
      "timestamp": 1765843200000,
      "hasDate": true,
      "imageUrl": "https://i.imgur.com/pKC2eGl.png",
      "newsUrl": "",
      "pageUrl": "",
      "newsImageUrl": "",
      "newsTitle": "",
      "slug": "premio-exclamacao"
    },
    {
      "award": "Satellite Awards",
      "status": "Anúncio dos Indicados",
      "statusKey": "indicados",
      "date": "16/12/2025",
      "dateISO": "2025-12-16",
      "timestamp": 1765843200000,
      "hasDate": true,
      "imageUrl": "https://i.imgur.com/kKsRV2S.png",
      "newsUrl": "https://www.termometrooscar.com/cinema-eacute-tudo-isso---blog/pecadores-lidera-com-14-indicacoes-o-satellite-awards-2026-wagner-moura-e-indicado-em-melhor-ator",
      "pageUrl": "",
      "newsImageUrl": "https://www.termometrooscar.com/uploads/1/4/8/8/1488234/wagner-moura-1wganenrn-pitomebeira_orig.jpg",
      "newsTitle": "\"Pecadores\" lidera com 14 indicações o Satellite Awards 2026! Wagner Moura é indicado em Melhor Ator!",
      "slug": "satellite-awards"
    },
    {
      "award": "Dallas-Fort Worth Film Critics Association Awards",
      "status": "Anúncio dos Vencedores",
      "statusKey": "vencedores",
      "date": "17/12/2025",
      "dateISO": "2025-12-17",
      "timestamp": 1765929600000,
      "hasDate": true,
      "imageUrl": "https://i.imgur.com/02v6T3k.png",
      "newsUrl": "https://www.termometrooscar.com/cinema-eacute-tudo-isso---blog/uma-batalha-apos-a-outra-vence-como-melhor-filme-rose-byrne-vence-como-atriz-por-se-eu-tivesse-pernas-te-chutaria-no-dallas-ft-worth-critics-association-awards-2025",
      "pageUrl": "",
      "newsImageUrl": "https://www.termometrooscar.com/uploads/1/4/8/8/1488234/g8u0qjmbkaakd4mif-i-had-legs-i-d-kick-you_orig.jpg",
      "newsTitle": "\"Uma Batalha Após a Outra\" vence como Melhor Filme, Rose Byrne vence como Atriz por \"Se Eu Tivesse Pernas, Te Chutaria\", no Dallas-Ft. Worth Critics Association Awards 2025!",
      "slug": "dallas-fort-worth-film-critics-association-awards"
    },
    {
      "award": "The Society of Composers and Lyricists Awards",
      "status": "Anúncio dos Indicados",
      "statusKey": "indicados",
      "date": "17/12/2025",
      "dateISO": "2025-12-17",
      "timestamp": 1765929600000,
      "hasDate": true,
      "imageUrl": "https://i.imgur.com/jr5IOlN.png",
      "newsUrl": "https://www.termometrooscar.com/cinema-eacute-tudo-isso---blog/wicked-parte-2-e-pecadores-lideram-com-3-indicacoes-cada-no-society-of-composers-and-lyricists-awards-2026-um-dos-maiores-termometros-para-o-oscar-de-cancao-original-e-trilha-sonora",
      "pageUrl": "",
      "newsImageUrl": "https://www.termometrooscar.com/uploads/1/4/8/8/1488234/published/wicked-for-good-ver21-xlg.jpg?1766086166",
      "newsTitle": "\"Wicked - parte 2\" e \"Pecadores\" lideram com 3 indicações cada no Society of Composers and Lyricists Awards 2026, um dos maiores termômetros para o Oscar de Canção Original e Trilha Sonora!",
      "slug": "the-society-of-composers-and-lyricists-awards"
    },
    {
      "award": "Austin Film Critics Association Awards",
      "status": "Anúncio dos Vencedores",
      "statusKey": "vencedores",
      "date": "18/12/2025",
      "dateISO": "2025-12-18",
      "timestamp": 1766016000000,
      "hasDate": true,
      "imageUrl": "https://i.imgur.com/9yE122I.png",
      "newsUrl": "https://www.termometrooscar.com/cinema-eacute-tudo-isso---blog/o-agente-secreto-vence-como-melhor-filme-internacional-e-uma-batalha-apos-a-outra-como-melhor-filme-no-austin-film-critics-association-awards-2025",
      "pageUrl": "",
      "newsImageUrl": "https://www.termometrooscar.com/uploads/1/4/8/8/1488234/entretenimento-o-agente-secreto_orig.jpg",
      "newsTitle": "\"O Agente Secreto\" vence como Melhor Filme Internacional e \"Uma Batalha Após a Outra\" como Melhor Filme no Austin Film Critics Association Awards 2025!",
      "slug": "austin-film-critics-association-awards"
    },
    {
      "award": "Black Film Critics Circle Awards",
      "status": "Anúncio dos Vencedores",
      "statusKey": "vencedores",
      "date": "18/12/2025",
      "dateISO": "2025-12-18",
      "timestamp": 1766016000000,
      "hasDate": true,
      "imageUrl": "https://i.imgur.com/3LKLIiX.png",
      "newsUrl": "https://www.termometrooscar.com/cinema-eacute-tudo-isso---blog/pecadores-leva-sete-premios-incluindo-melhor-filme-no-black-film-critics-circle-awards-2025",
      "pageUrl": "",
      "newsImageUrl": "https://www.termometrooscar.com/uploads/1/4/8/8/1488234/sinners-sinnerssinnerssinnerssinnerssinners234457800_orig.jpg",
      "newsTitle": "\"Pecadores\" leva sete prêmios, incluindo Melhor Filme, no Black Film Critics Circle Awards 2025!",
      "slug": "black-film-critics-circle-awards"
    },
    {
      "award": "Online Association of Female Film Critics Awards",
      "status": "Anúncio dos Indicados",
      "statusKey": "indicados",
      "date": "18/12/2025",
      "dateISO": "2025-12-18",
      "timestamp": 1766016000000,
      "hasDate": true,
      "imageUrl": "https://i.imgur.com/km1acLL.png",
      "newsUrl": "https://www.termometrooscar.com/cinema-eacute-tudo-isso---blog/uma-batalha-apos-a-outra-lidera-com-13-indicacoes-no-online-association-of-female-film-critics-awards-2025-eva-victor-de-sorry-baby-chama-atencao-com-5-indicacoes",
      "pageUrl": "",
      "newsImageUrl": "https://www.termometrooscar.com/uploads/1/4/8/8/1488234/sorry-babyhamnethamnethamnethamnethamnethamnet123_orig.jpg",
      "newsTitle": "\"Uma Batalha Após a Outra\" lidera com 13 indicações no Online Association of Female Film Critics Awards 2025! Eva Victor, de \"Sorry, Baby\", chama atenção com 5 indicações!",
      "slug": "online-association-of-female-film-critics-awards"
    },
    {
      "award": "Florida Film Critics Circle Awards",
      "status": "Anúncio dos Vencedores",
      "statusKey": "vencedores",
      "date": "19/12/2025",
      "dateISO": "2025-12-19",
      "timestamp": 1766102400000,
      "hasDate": true,
      "imageUrl": "https://i.imgur.com/DlYPHss.png",
      "newsUrl": "https://www.termometrooscar.com/cinema-eacute-tudo-isso---blog/uma-batalha-apos-a-outra-vence-como-melhor-filme-no-florida-film-critics-circle-awards-2025-josh-oconnor-vence-como-melhor-ator-por-the-mastermind",
      "pageUrl": "",
      "newsImageUrl": "https://www.termometrooscar.com/uploads/1/4/8/8/1488234/the-mastermind-blog-de-hollywood_orig.jpg",
      "newsTitle": "\"Uma Batalha Após a Outra\" vence como Melhor Filme no Florida Film Critics Circle Awards 2025, Josh O'Connor vence como Melhor Ator por \"The Mastermind\"!",
      "slug": "florida-film-critics-circle-awards"
    },
    {
      "award": "Georgia Film Critics Association Awards",
      "status": "Anúncio dos Indicados",
      "statusKey": "indicados",
      "date": "19/12/2025",
      "dateISO": "2025-12-19",
      "timestamp": 1766102400000,
      "hasDate": true,
      "imageUrl": "https://i.imgur.com/EJkUTGy.png",
      "newsUrl": "https://www.termometrooscar.com/cinema-eacute-tudo-isso---blog/uma-batalha-apos-a-outra-lidera-com-12-indicacoes-mas-codigo-preto-chama-atencao-indicado-em-melhor-filme-e-melhor-elenco-no-georgia-film-critics-awards-2025",
      "pageUrl": "",
      "newsImageUrl": "https://www.termometrooscar.com/uploads/1/4/8/8/1488234/published/mbydkeu92tye1c-digo-pretoc-digo-preto.jpg?1766409295",
      "newsTitle": "\"Uma Batalha Após a Outra\" lidera com 12 indicações, mas \"Código Preto\" chama atenção indicado em Melhor Filme e Melhor Elenco no Georgia Film Critics Awards 2025!",
      "slug": "georgia-film-critics-association-awards"
    },
    {
      "award": "Las Vegas Film Critics Society Awards",
      "status": "Anúncio dos Vencedores",
      "statusKey": "vencedores",
      "date": "19/12/2025",
      "dateISO": "2025-12-19",
      "timestamp": 1766102400000,
      "hasDate": true,
      "imageUrl": "https://i.imgur.com/Vjl6gZw.png",
      "newsUrl": "https://www.termometrooscar.com/cinema-eacute-tudo-isso---blog/uma-batalha-apos-a-outra-vence-como-melhor-filme-no-las-vegas-film-critics-society-awards-2025-amanda-seyfried-leva-como-melhor-atriz-por-o-testamento-de-ann-lee",
      "pageUrl": "",
      "newsImageUrl": "https://www.termometrooscar.com/uploads/1/4/8/8/1488234/amanda-seyfried-testament-of-annseja-bem-vindo_orig.jpg",
      "newsTitle": "\"Uma Batalha Após a Outra\" vence como Melhor Filme no Las Vegas Film Critics Society Awards 2025! Amanda Seyfried leva como Melhor Atriz por \"O Testamento de Ann Lee\"!",
      "slug": "las-vegas-film-critics-society-awards"
    },
    {
      "award": "Online Association of Female Film Critics Awards",
      "status": "Anúncio dos Vencedores",
      "statusKey": "vencedores",
      "date": "19/12/2025",
      "dateISO": "2025-12-19",
      "timestamp": 1766102400000,
      "hasDate": true,
      "imageUrl": "https://i.imgur.com/km1acLL.png",
      "newsUrl": "termometrooscar.com/cinema-eacute-tudo-isso---blog/pecadores-vence-como-melhor-filme-e-melhor-ator-para-michael-b-jordan-no-online-association-of-female-film-critics-awards-2025",
      "pageUrl": "",
      "newsImageUrl": "https://www.termometrooscar.com/uploads/1/4/8/8/1488234/formato-fotos-black-zip-1online-association-of-female-critics-awards_orig.jpg",
      "newsTitle": "\"Pecadores\" vence como Melhor Filme e Melhor Ator para Michael B. Jordan no Online Association of Female Film Critics Awards 2025!",
      "slug": "online-association-of-female-film-critics-awards"
    },
    {
      "award": "Philadelphia Film Critics Circle Awards",
      "status": "Anúncio dos Vencedores",
      "statusKey": "vencedores",
      "date": "20/12/2025",
      "dateISO": "2025-12-20",
      "timestamp": 1766188800000,
      "hasDate": true,
      "imageUrl": "https://i.imgur.com/nL2k8lo.png",
      "newsUrl": "http://termometrooscar.com/cinema-eacute-tudo-isso---blog/o-philadelphia-film-critics-circle-awards-2025-premia-uma-batalha-apos-a-outra-como-o-melhor-filme-do-ano-e-benicio-del-toro-e-teyana-taylor-vencem-como-coadjuvantes",
      "pageUrl": "",
      "newsImageUrl": "https://www.termometrooscar.com/uploads/1/4/8/8/1488234/onebattleafteranother-092425-03teyana-taylor_orig.jpg",
      "newsTitle": "O Philadelphia Film Critics Circle Awards 2025 premia \"Uma Batalha Após a Outra\" como o Melhor Filme do Ano e Benicio del Toro e Teyana Taylor vencem como Coadjuvantes!",
      "slug": "philadelphia-film-critics-circle-awards"
    },
    {
      "award": "Utah Film Critics Association Awards",
      "status": "Anúncio dos Indicados",
      "statusKey": "indicados",
      "date": "20/12/2025",
      "dateISO": "2025-12-20",
      "timestamp": 1766188800000,
      "hasDate": true,
      "imageUrl": "https://i.imgur.com/TesXUFj.png",
      "newsUrl": "https://www.termometrooscar.com/cinema-eacute-tudo-isso---blog/uma-batalha-apos-a-outra-lidera-com-13-indicacoes-no-utah-film-critics-association-awards-2025",
      "pageUrl": "",
      "newsImageUrl": "https://www.termometrooscar.com/uploads/1/4/8/8/1488234/published/g8ufp2cweakjj3hone-battle-after-another.jpg?1766495670",
      "newsTitle": "\"Uma Batalha Após a Outra\" lidera com 13 indicações no Utah Film Critics Association Awards 2025!",
      "slug": "utah-film-critics-association-awards"
    },
    {
      "award": "Kansas City Film Critics Circle Awards",
      "status": "Anúncio dos Vencedores",
      "statusKey": "vencedores",
      "date": "21/12/2025",
      "dateISO": "2025-12-21",
      "timestamp": 1766275200000,
      "hasDate": true,
      "imageUrl": "https://i.imgur.com/Vlse6YN.png",
      "newsUrl": "https://www.termometrooscar.com/cinema-eacute-tudo-isso---blog/uma-batalha-apos-a-outra-vence-como-melhor-filme-roteiro-adaptado-e-direcao-para-paul-thomas-anderson-no-kansas-city-film-critics-circle-awards-2025",
      "pageUrl": "",
      "newsImageUrl": "https://www.termometrooscar.com/uploads/1/4/8/8/1488234/g7zmmyfxcaeufbbuma-batalha-ap-s-a-outrav_orig.jpg",
      "newsTitle": "\"Uma Batalha Após a Outra\" vence como Melhor Filme, Roteiro Adaptado e Direção para Paul Thomas Anderson no Kansas City Film Critics Circle Awards 2025!",
      "slug": "kansas-city-film-critics-circle-awards"
    },
    {
      "award": "Alliance of Women Film Journalists EDA Awards",
      "status": "Anúncio dos Indicados",
      "statusKey": "indicados",
      "date": "22/12/2025",
      "dateISO": "2025-12-22",
      "timestamp": 1766361600000,
      "hasDate": true,
      "imageUrl": "https://i.imgur.com/QTJKBX3.png",
      "newsUrl": "https://www.termometrooscar.com/cinema-eacute-tudo-isso---blog/o-agente-secreto-e-indicado-em-melhor-filme-e-melhor-ator-no-eda-awards-2025-a-premiacao-da-alianca-das-mulheres-jornalistas-de-cinema-uma-batalha-apos-a-outra-lidera-a-premiacao",
      "pageUrl": "",
      "newsImageUrl": "https://www.termometrooscar.com/uploads/1/4/8/8/1488234/wagner-moura-on-the-phone-at-a-p_orig.jpg",
      "newsTitle": "\"O Agente Secreto\" é indicado em Melhor Filme e Melhor Ator no EDA Awards 2025, a premiação da Aliança das Mulheres Jornalistas de Cinema! \"Uma Batalha Após a Outra\" lidera a premiação!",
      "slug": "alliance-of-women-film-journalists-eda-awards"
    },
    {
      "award": "North Texas Film Critics Association Awards",
      "status": "Anúncio dos Indicados",
      "statusKey": "indicados",
      "date": "22/12/2025",
      "dateISO": "2025-12-22",
      "timestamp": 1766361600000,
      "hasDate": true,
      "imageUrl": "https://i.imgur.com/7gtBnfr.png",
      "newsUrl": "https://www.termometrooscar.com/cinema-eacute-tudo-isso---blog/uma-batalha-apos-a-outra-lidera-as-indicacoes-no-north-texas-film-critics-awards-2025-e-dwayne-johnson-volta-a-ser-indicado-em-melhor-ator-por-coracao-de-lutador",
      "pageUrl": "",
      "newsImageUrl": "https://www.termometrooscar.com/uploads/1/4/8/8/1488234/02cul-smashingmachine-review1-bj_orig.jpg",
      "newsTitle": "\"Uma Batalha Após a Outra\" lidera as indicações no North Texas Film Critics Awards 2025, e Dwayne Johnson volta a ser indicado em Melhor Ator por \"Coração de Lutador\"!",
      "slug": "north-texas-film-critics-association-awards"
    },
    {
      "award": "Georgia Film Critics Association Awards",
      "status": "Anúncio dos Vencedores",
      "statusKey": "vencedores",
      "date": "27/12/2025",
      "dateISO": "2025-12-27",
      "timestamp": 1766793600000,
      "hasDate": true,
      "imageUrl": "https://i.imgur.com/EJkUTGy.png",
      "newsUrl": "https://www.termometrooscar.com/cinema-eacute-tudo-isso---blog/uma-batalha-apos-a-outra-vence-como-melhor-filme-e-timothee-chalamet-e-melhor-ator-por-marty-supreme-no-georgia-film-critics-association-awards-2025",
      "pageUrl": "",
      "newsImageUrl": "https://www.termometrooscar.com/uploads/1/4/8/8/1488234/g8-nx8ob0aegzv4timoth-e-chalamet_orig.jpg",
      "newsTitle": "\"Uma Batalha Após a Outra\" vence como Melhor Filme, e Timothée Chalamet é Melhor Ator por \"Marty Supreme\" no Georgia Film Critics Association Awards 2025!",
      "slug": "georgia-film-critics-association-awards"
    },
    {
      "award": "Iowa Film Critics Association Awards",
      "status": "Anúncio dos Vencedores",
      "statusKey": "vencedores",
      "date": "28/12/2025",
      "dateISO": "2025-12-28",
      "timestamp": 1766880000000,
      "hasDate": true,
      "imageUrl": "https://i.imgur.com/YWALoLJ.png",
      "newsUrl": "https://www.termometrooscar.com/cinema-eacute-tudo-isso---blog/hamnet-vence-em-melhor-filme-no-iowa-film-critics-association-awards-2025-jessie-buckley-e-melhor-atriz",
      "pageUrl": "",
      "newsImageUrl": "https://www.termometrooscar.com/uploads/1/4/8/8/1488234/g8uf-nqxcaagxbest-filmbest-filmbest-filmog_orig.jpg",
      "newsTitle": "\"Hamnet\" vence em Melhor Filme no Iowa Film Critics Association Awards 2025! Jessie Buckley é Melhor Atriz!",
      "slug": "iowa-film-critics-association-awards"
    },
    {
      "award": "Make-Up Artists and Hair Stylist Guild Awards",
      "status": "Anúncio dos Indicados",
      "statusKey": "indicados",
      "date": "29/12/2025",
      "dateISO": "2025-12-29",
      "timestamp": 1766966400000,
      "hasDate": true,
      "imageUrl": "https://i.imgur.com/KoFaxBl.png",
      "newsUrl": "https://www.termometrooscar.com/cinema-eacute-tudo-isso---blog/frankenstein-pecadores-wicked-parte-2-uma-batalha-apos-a-outra-e-a-hora-do-mal-lideram-com-3-indicacoes-cada-no-makeup-artist-and-hair-stylist-guild-awards-2026-a-premiacao-do-sindicato-dos-maquiadores",
      "pageUrl": "",
      "newsImageUrl": "https://www.termometrooscar.com/uploads/1/4/8/8/1488234/jacob-elordi-se-preparando-para_orig.jpg",
      "newsTitle": "\"Frankenstein\", \"Pecadores\", \"Wicked - parte 2\", \"Uma Batalha Após a Outra\" e \"A Hora do Mal\" lideram com 3 indicações cada no Makeup Artist and Hair Stylist Guild Awards 2026, a premiação do Sindicato dos Maquiadores!",
      "slug": "make-up-artists-and-hair-stylist-guild-awards"
    },
    {
      "award": "North Texas Film Critics Association Awards",
      "status": "Anúncio dos Vencedores",
      "statusKey": "vencedores",
      "date": "29/12/2025",
      "dateISO": "2025-12-29",
      "timestamp": 1766966400000,
      "hasDate": true,
      "imageUrl": "https://i.imgur.com/7gtBnfr.png",
      "newsUrl": "https://www.termometrooscar.com/cinema-eacute-tudo-isso---blog/pecadores-leva-melhor-filme-e-entrega-um-premio-de-melhor-ator-coadjuvante-para-delroy-lindo-no-north-texas-film-critics-awards-2025",
      "pageUrl": "",
      "newsImageUrl": "https://www.termometrooscar.com/uploads/1/4/8/8/1488234/sinnnnnner-s-delro-ojet_orig.jpg",
      "newsTitle": "\"Pecadores\" leva Melhor Filme e entrega um prêmio de Melhor Ator Coadjuvante para Delroy Lindo, no North Texas Film Critics Awards 2025!",
      "slug": "north-texas-film-critics-association-awards"
    },
    {
      "award": "Alliance of Women Film Journalists EDA Awards",
      "status": "Anúncio dos Vencedores",
      "statusKey": "vencedores",
      "date": "31/12/2025",
      "dateISO": "2025-12-31",
      "timestamp": 1767139200000,
      "hasDate": true,
      "imageUrl": "https://i.imgur.com/QTJKBX3.png",
      "newsUrl": "https://www.termometrooscar.com/cinema-eacute-tudo-isso---blog/pecadores-vence-como-melhor-filme-direcao-e-melhor-ator-para-michael-b-jordan-no-eda-awards-2025",
      "pageUrl": "",
      "newsImageUrl": "https://www.termometrooscar.com/uploads/1/4/8/8/1488234/g9qmdvxxiaa1xsupr-mio-eda-de-foco-feminino_orig.jpg",
      "newsTitle": "\"Pecadores\" vence como Melhor Filme, Direção e Melhor Ator para Michael B. Jordan no EDA Awards 2025!",
      "slug": "alliance-of-women-film-journalists-eda-awards"
    },
    {
      "award": "National Society of Film Critics Awards",
      "status": "Anúncio dos Vencedores",
      "statusKey": "vencedores",
      "date": "03/01/2026",
      "dateISO": "2026-01-03",
      "timestamp": 1767398400000,
      "hasDate": true,
      "imageUrl": "https://i.imgur.com/N09M5Ir.png",
      "newsUrl": "https://www.termometrooscar.com/cinema-eacute-tudo-isso---blog/o-agente-secreto-vence-como-melhor-filme-internacional-no-national-society-of-film-critics-awards-2026-uma-batalha-apos-a-outra-vence-como-melhor-filme",
      "pageUrl": "",
      "newsImageUrl": "https://www.termometrooscar.com/uploads/1/4/8/8/1488234/published/g8nvnrywcaaxh-vkathleen-chalfant-por-que-familiar.jpg?1767530595",
      "newsTitle": "\"O Agente Secreto\" vence como Melhor Filme Internacional no National Society of Film Critics Awards 2026! \"Uma Batalha Após a Outra\" vence como Melhor Filme!",
      "slug": "national-society-of-film-critics-awards"
    },
    {
      "award": "Columbus Film Critics Association Awards",
      "status": "Anúncio dos Indicados",
      "statusKey": "indicados",
      "date": "04/01/2026",
      "dateISO": "2026-01-04",
      "timestamp": 1767484800000,
      "hasDate": true,
      "imageUrl": "https://i.imgur.com/08Ax3JK.png",
      "newsUrl": "https://www.termometrooscar.com/cinema-eacute-tudo-isso---blog/uma-batalha-apos-a-outra-lidera-com-14-indicacoes-no-columbus-film-critics-association-awards-2025-vivo-ou-morto-um-misterio-knives-out-chama-atencao-indicado-em-filme-e-direcao",
      "pageUrl": "",
      "newsImageUrl": "https://www.termometrooscar.com/uploads/1/4/8/8/1488234/daniel-craig-josh-o-connor-mila_orig.jpg",
      "newsTitle": "\"Uma Batalha Após a Outra\" lidera com 14 indicações no Columbus Film Critics Association Awards 2025! \"Vivo ou Morto: Um Mistério Knives Out\" chama atenção indicado em Filme e Direção!",
      "slug": "columbus-film-critics-association-awards"
    },
    {
      "award": "Critics Choice Movie Awards",
      "status": "Anúncio dos Vencedores",
      "statusKey": "vencedores",
      "date": "04/01/2026",
      "dateISO": "2026-01-04",
      "timestamp": 1767484800000,
      "hasDate": true,
      "imageUrl": "https://i.imgur.com/PbTVmdT.png",
      "newsUrl": "https://www.termometrooscar.com/cinema-eacute-tudo-isso---blog/uma-batalha-apos-a-outra-e-o-vencedor-de-melhor-filme-no-critics-choice-movie-awards-2026-o-agente-secreto-vence-como-melhor-filme-internacional",
      "pageUrl": "",
      "newsImageUrl": "https://www.termometrooscar.com/uploads/1/4/8/8/1488234/published/g8nx1rfwsaaxqkouma-batalha-ap-s-a-outrauma-batalha-ap-s-a-outra.jpg?1767580865",
      "newsTitle": "\"Uma Batalha Após a Outra\" é o vencedor de Melhor Filme no Critics’ Choice Movie Awards 2026! \"O Agente Secreto\" vence como Melhor Filme Internacional!",
      "slug": "critics-choice-movie-awards"
    },
    {
      "award": "Annie Awards",
      "status": "Anúncio dos Indicados",
      "statusKey": "indicados",
      "date": "05/01/2026",
      "dateISO": "2026-01-05",
      "timestamp": 1767571200000,
      "hasDate": true,
      "imageUrl": "https://i.imgur.com/3AzDQVF.png",
      "newsUrl": "https://www.termometrooscar.com/cinema-eacute-tudo-isso---blog/elio-e-guerreiras-do-k-pop-lideram-com-10-indicacoes-cada-o-annie-awards-2026",
      "pageUrl": "",
      "newsImageUrl": "https://www.termometrooscar.com/uploads/1/4/8/8/1488234/elio-kpopopopopo-otojet_orig.jpg",
      "newsTitle": "\"Elio\" e \"Guerreiras do K-POP\" lideram com 10 indicações cada o Annie Awards 2026!",
      "slug": "annie-awards"
    },
    {
      "award": "Chicago Independent Film Critics Circle Awards",
      "status": "Anúncio dos Indicados",
      "statusKey": "indicados",
      "date": "06/01/2026",
      "dateISO": "2026-01-06",
      "timestamp": 1767657600000,
      "hasDate": true,
      "imageUrl": "https://i.imgur.com/omkFAet.png",
      "newsUrl": "https://www.termometrooscar.com/cinema-eacute-tudo-isso---blog/pecadores-lidera-com-18-indicacoes-no-chicago-indie-critics-awards-2025-exterminio-a-evolucao-chama-atencao-indicado-em-melhor-filme",
      "pageUrl": "",
      "newsImageUrl": "https://www.termometrooscar.com/uploads/1/4/8/8/1488234/g9c-p4wwy28-years-later28-years-lateraapwkv_orig.jpg",
      "newsTitle": "\"Pecadores\" lidera com 18 indicações no Chicago Indie Critics Awards 2025! \"Extermínio: A Evolução\" chama atenção indicado em Melhor Filme!",
      "slug": "chicago-independent-film-critics-circle-awards"
    },
    {
      "award": "Art Directors Guild Awards",
      "status": "Anúncio dos Indicados",
      "statusKey": "indicados",
      "date": "07/01/2026",
      "dateISO": "2026-01-07",
      "timestamp": 1767744000000,
      "hasDate": true,
      "imageUrl": "https://i.imgur.com/6Q2pQGV.png",
      "newsUrl": "https://www.termometrooscar.com/cinema-eacute-tudo-isso---blog/frankenstein-pecadores-quarteto-fantastico-primeiros-passos-veja-os-indicados-ao-art-directors-guild-awards-2026-a-premiacao-do-sindicato-dos-diretores-de-arte",
      "pageUrl": "",
      "newsImageUrl": "https://www.termometrooscar.com/uploads/1/4/8/8/1488234/quarteto-fantastico-primeiros-paquarteto-fant-sticquarteto-fant-stico-primeiros-passos_orig.jpg",
      "newsTitle": "\"Frankenstein\", \"Pecadores\", \"Quarteto Fantástico: Primeiros Passos\"... Veja os indicados ao Art Directors Guild Awards 2026, a premiação do Sindicato dos Diretores de Arte!",
      "slug": "art-directors-guild-awards"
    },
    {
      "award": "The Actor Awards",
      "status": "Anúncio dos Indicados",
      "statusKey": "indicados",
      "date": "07/01/2026",
      "dateISO": "2026-01-07",
      "timestamp": 1767744000000,
      "hasDate": true,
      "imageUrl": "https://i.imgur.com/7XfcN3n.png",
      "newsUrl": "https://www.termometrooscar.com/cinema-eacute-tudo-isso---blog/uma-batalha-apos-a-outra-lidera-com-7-indicacoes-e-bate-recorde-sendo-indicado-em-todas-as-categorias-no-the-actor-awards-2026",
      "pageUrl": "",
      "newsImageUrl": "https://www.termometrooscar.com/uploads/1/4/8/8/1488234/one-bathle-the-actor-123-ojet_orig.jpg",
      "newsTitle": "\"Uma Batalha Após a Outra\" lidera com 7 indicações e bate recorde sendo indicado em todas as categorias no The Actor Awards 2026!",
      "slug": "the-actor-awards"
    },
    {
      "award": "American Society of Cinematographers Awards",
      "status": "Anúncio dos Indicados",
      "statusKey": "indicados",
      "date": "08/01/2026",
      "dateISO": "2026-01-08",
      "timestamp": 1767830400000,
      "hasDate": true,
      "imageUrl": "https://i.imgur.com/fC8vIks.png",
      "newsUrl": "https://www.termometrooscar.com/cinema-eacute-tudo-isso---blog/com-o-brasileiro-adolpho-veloso-de-sonhos-de-trem-conheca-os-indicados-ao-american-society-of-cinematographers-awards-2026-a-premiacao-dos-profissionais-de-fotografia",
      "pageUrl": "",
      "newsImageUrl": "https://www.termometrooscar.com/uploads/1/4/8/8/1488234/train-dreams-u-00-19-06-13-r-etraind-dreamms-17_orig.jpg",
      "newsTitle": "Com o brasileiro Adolpho Veloso de \"Sonhos de Trem\", conheça os indicados ao American Society of Cinematographers Awards 2026, a premiação dos profissionais de fotografia!",
      "slug": "american-society-of-cinematographers-awards"
    },
    {
      "award": "Cinema Eye Honors Awards",
      "status": "Anúncio dos Vencedores",
      "statusKey": "vencedores",
      "date": "08/01/2026",
      "dateISO": "2026-01-08",
      "timestamp": 1767830400000,
      "hasDate": true,
      "imageUrl": "https://i.imgur.com/foayYNY.png",
      "newsUrl": "https://www.termometrooscar.com/cinema-eacute-tudo-isso---blog/embaixo-da-luz-de-neon-vence-como-melhor-documentario-no-cinema-eye-honors-award-2025",
      "pageUrl": "",
      "newsImageUrl": "https://www.termometrooscar.com/uploads/1/4/8/8/1488234/come-see-me-in-the-good-lightembaixo-da-luz-de-neon_orig.jpg",
      "newsTitle": "\"Embaixo da Luz de Neon\" vence como Melhor Documentário no Cinema Eye Honors Award 2026!",
      "slug": "cinema-eye-honors-awards"
    },
    {
      "award": "Columbus Film Critics Association Awards",
      "status": "Anúncio dos Vencedores",
      "statusKey": "vencedores",
      "date": "08/01/2026",
      "dateISO": "2026-01-08",
      "timestamp": 1767830400000,
      "hasDate": true,
      "imageUrl": "https://i.imgur.com/08Ax3JK.png",
      "newsUrl": "https://www.termometrooscar.com/cinema-eacute-tudo-isso---blog/uma-batalha-apos-a-outra-vence-como-melhor-filme-em-uma-grande-vitoria-com-7-premios-no-columbus-film-critics-association-awards-2025",
      "pageUrl": "",
      "newsImageUrl": "https://www.termometrooscar.com/uploads/1/4/8/8/1488234/onde-assistir-uma-batalha-apos-a_orig.jpg",
      "newsTitle": "\"Uma Batalha Após a Outra\" vence como Melhor Filme em uma grande vitória com 7 prêmios no Columbus Film Critics Association Awards 2025!",
      "slug": "columbus-film-critics-association-awards"
    },
    {
      "award": "Directors Guild of America Awards",
      "status": "Anúncio dos Indicados",
      "statusKey": "indicados",
      "date": "08/01/2026",
      "dateISO": "2026-01-08",
      "timestamp": 1767830400000,
      "hasDate": true,
      "imageUrl": "https://i.imgur.com/FWn3YNA.png",
      "newsUrl": "https://www.termometrooscar.com/cinema-eacute-tudo-isso---blog/safdie-coogler-pta-zhao-e-del-toro-sao-indicados-ao-directors-guild-of-america-awards-2026-veja-os-motivos-do-premio-ser-o-melhor-em-previsao-ao-oscar",
      "pageUrl": "",
      "newsImageUrl": "https://www.termometrooscar.com/uploads/1/4/8/8/1488234/dg-agd-agdgdgd-adga-director-ojet_orig.jpg",
      "newsTitle": "Safdie, Coogler, PTA, Zhao e del Toro são indicados ao Directors Guild of America Awards 2026! Veja os motivos do prêmio ser o melhor em previsão ao Oscar!",
      "slug": "directors-guild-of-america-awards"
    },
    {
      "award": "Artios Awards (Casting Society)",
      "status": "Anúncio dos Indicados",
      "statusKey": "indicados",
      "date": "09/01/2026",
      "dateISO": "2026-01-09",
      "timestamp": 1767916800000,
      "hasDate": true,
      "imageUrl": "https://i.imgur.com/UbvehH5.png",
      "newsUrl": "https://www.termometrooscar.com/cinema-eacute-tudo-isso---blog/com-3-indicacoes-para-douglas-aibel-por-jay-kelly-o-esquema-fenicio-e-amores-materialistas-conheca-os-indicados-do-artios-awards-2026-a-premiacao-dos-diretores-de-elenco",
      "pageUrl": "",
      "newsImageUrl": "https://www.termometrooscar.com/uploads/1/4/8/8/1488234/jay-kelly-filme-da-netflix-com-g_orig.jpg",
      "newsTitle": "Com 3 indicações para Douglas Aibel, por \"Jay Kelly\", \"O Esquema Fenício\" e \"Amores Materialistas\", conheça os indicados do Artios Awards 2026, a premiação dos diretores de elenco!",
      "slug": "artios-awards-casting-society"
    },
    {
      "award": "Astra Film Awards (Hollywood Creative Alliance)",
      "status": "Anúncio dos Vencedores",
      "statusKey": "vencedores",
      "date": "09/01/2026",
      "dateISO": "2026-01-09",
      "timestamp": 1767916800000,
      "hasDate": true,
      "imageUrl": "https://i.imgur.com/7BrmYgM.png",
      "newsUrl": "https://www.termometrooscar.com/cinema-eacute-tudo-isso---blog/pecadores-e-o-grande-vencedor-do-astra-film-awards-2025",
      "pageUrl": "",
      "newsImageUrl": "https://www.termometrooscar.com/uploads/1/4/8/8/1488234/published/img-8716-1sinnnenirnisninsinansinasinas-123-556-7.jpg?1768048881",
      "newsTitle": "\"Pecadores\" é o grande vencedor do Astra Film Awards 2025!",
      "slug": "astra-film-awards-hollywood-creative-alliance"
    },
    {
      "award": "BAFTA",
      "status": "Longlist",
      "statusKey": "outro",
      "date": "09/01/2026",
      "dateISO": "2026-01-09",
      "timestamp": 1767916800000,
      "hasDate": true,
      "imageUrl": "https://i.imgur.com/HC5OPdJ.png",
      "newsUrl": "",
      "pageUrl": "",
      "newsImageUrl": "",
      "newsTitle": "",
      "slug": "bafta"
    },
    {
      "award": "Producers Guild of America Awards",
      "status": "Anúncio dos Indicados (Filme)",
      "statusKey": "indicados",
      "date": "09/01/2026",
      "dateISO": "2026-01-09",
      "timestamp": 1767916800000,
      "hasDate": true,
      "imageUrl": "https://i.imgur.com/S8SzYV8.png",
      "newsUrl": "https://www.termometrooscar.com/cinema-eacute-tudo-isso---blog/frankenstein-f1-a-hora-do-mal-confira-os-10-nomeados-a-melhor-filme-no-producers-guild-awards-2026-a-premiacao-do-sindicato-dos-produtores",
      "pageUrl": "",
      "newsImageUrl": "https://www.termometrooscar.com/uploads/1/4/8/8/1488234/fpga-pga-pg-af1-wepason-otojet_orig.jpg",
      "newsTitle": "\"Frankenstein\", \"F1\", \"A Hora do Mal\"... Confira os 10 nomeados a Melhor Filme no Producers Guild Awards 2026, a premiação do Sindicato dos Produtores!",
      "slug": "producers-guild-of-america-awards"
    },
    {
      "award": "Globo de Ouro",
      "status": "Anúncio dos Vencedores",
      "statusKey": "vencedores",
      "date": "11/01/2026",
      "dateISO": "2026-01-11",
      "timestamp": 1768089600000,
      "hasDate": true,
      "imageUrl": "https://i.imgur.com/Xu9KJaq.png",
      "newsUrl": "https://www.termometrooscar.com/cinema-eacute-tudo-isso---blog/o-agente-secreto-ganha-como-melhor-filme-internacional-e-melhor-ator-em-drama-para-wagner-moura-no-globo-de-ouro-2026-uma-batalha-apos-a-outra-lidera-os-premios",
      "pageUrl": "",
      "newsImageUrl": "https://www.termometrooscar.com/uploads/1/4/8/8/1488234/o-agente-secreto-critica-do-asdsadsdsad333_orig.jpg",
      "newsTitle": "\"O Agente Secreto\" ganha como Melhor Filme Internacional e Melhor Ator em Drama para Wagner Moura no Globo de Ouro 2026! \"Uma Batalha Após a Outra\" lidera os prêmios!",
      "slug": "globo-de-ouro"
    },
    {
      "award": "MPSE Golden Reel Awards",
      "status": "Anúncio dos Indicados",
      "statusKey": "indicados",
      "date": "12/01/2026",
      "dateISO": "2026-01-12",
      "timestamp": 1768176000000,
      "hasDate": true,
      "imageUrl": "https://i.imgur.com/4dJ8wwB.png",
      "newsUrl": "",
      "pageUrl": "",
      "newsImageUrl": "",
      "newsTitle": "",
      "slug": "mpse-golden-reel-awards"
    },
    {
      "award": "North Carolina Film Critics Association Awards",
      "status": "Anúncio dos Indicados",
      "statusKey": "indicados",
      "date": "12/01/2026",
      "dateISO": "2026-01-12",
      "timestamp": 1768176000000,
      "hasDate": true,
      "imageUrl": "https://i.imgur.com/AhwwOGK.png",
      "newsUrl": "",
      "pageUrl": "",
      "newsImageUrl": "",
      "newsTitle": "",
      "slug": "north-carolina-film-critics-association-awards"
    },
    {
      "award": "Online Film Critics Society Awards",
      "status": "Anúncio dos Indicados",
      "statusKey": "indicados",
      "date": "12/01/2026",
      "dateISO": "2026-01-12",
      "timestamp": 1768176000000,
      "hasDate": true,
      "imageUrl": "https://i.imgur.com/ROCLSVN.png",
      "newsUrl": "",
      "pageUrl": "",
      "newsImageUrl": "",
      "newsTitle": "",
      "slug": "online-film-critics-society-awards"
    },
    {
      "award": "Oscar",
      "status": "Início da Votação da Academia para as Nomeações",
      "statusKey": "outro",
      "date": "12/01/2026",
      "dateISO": "2026-01-12",
      "timestamp": 1768176000000,
      "hasDate": true,
      "imageUrl": "https://i.imgur.com/guBEPZm.png",
      "newsUrl": "",
      "pageUrl": "",
      "newsImageUrl": "",
      "newsTitle": "",
      "slug": "oscar"
    },
    {
      "award": "Houston Film Critics Society Awards",
      "status": "Anúncio dos Indicados",
      "statusKey": "indicados",
      "date": "13/01/2026",
      "dateISO": "2026-01-13",
      "timestamp": 1768262400000,
      "hasDate": true,
      "imageUrl": "https://i.imgur.com/DKTYUjB.png",
      "newsUrl": "",
      "pageUrl": "",
      "newsImageUrl": "",
      "newsTitle": "",
      "slug": "houston-film-critics-society-awards"
    },
    {
      "award": "Visual Effects Society Awards",
      "status": "Anúncio dos Indicados",
      "statusKey": "indicados",
      "date": "13/01/2026",
      "dateISO": "2026-01-13",
      "timestamp": 1768262400000,
      "hasDate": true,
      "imageUrl": "https://i.imgur.com/rmzHXXg.png",
      "newsUrl": "",
      "pageUrl": "",
      "newsImageUrl": "",
      "newsTitle": "",
      "slug": "visual-effects-society-awards"
    },
    {
      "award": "GALECA: The Society of LGBTQ Entertainment Critics Awards",
      "status": "Anúncio dos Vencedores",
      "statusKey": "vencedores",
      "date": "14/01/2026",
      "dateISO": "2026-01-14",
      "timestamp": 1768348800000,
      "hasDate": true,
      "imageUrl": "https://i.imgur.com/KtzeFFw.png",
      "newsUrl": "",
      "pageUrl": "",
      "newsImageUrl": "",
      "newsTitle": "",
      "slug": "galeca-the-society-of-lgbtq-entertainment-critics-awards"
    },
    {
      "award": "Chicago Independent Film Critics Circle Awards",
      "status": "Anúncio dos Vencedores",
      "statusKey": "vencedores",
      "date": "15/01/2026",
      "dateISO": "2026-01-15",
      "timestamp": 1768435200000,
      "hasDate": true,
      "imageUrl": "https://i.imgur.com/omkFAet.png",
      "newsUrl": "",
      "pageUrl": "",
      "newsImageUrl": "",
      "newsTitle": "",
      "slug": "chicago-independent-film-critics-circle-awards"
    },
    {
      "award": "Oscar",
      "status": "Fim da Votação da Academia para as Nomeações",
      "statusKey": "outro",
      "date": "16/01/2026",
      "dateISO": "2026-01-16",
      "timestamp": 1768521600000,
      "hasDate": true,
      "imageUrl": "https://i.imgur.com/guBEPZm.png",
      "newsUrl": "",
      "pageUrl": "",
      "newsImageUrl": "",
      "newsTitle": "",
      "slug": "oscar"
    },
    {
      "award": "Prêmio Exclamação",
      "status": "Fim da votação de nomeação",
      "statusKey": "outro",
      "date": "16/01/2026",
      "dateISO": "2026-01-16",
      "timestamp": 1768521600000,
      "hasDate": true,
      "imageUrl": "https://i.imgur.com/pKC2eGl.png",
      "newsUrl": "",
      "pageUrl": "",
      "newsImageUrl": "",
      "newsTitle": "",
      "slug": "premio-exclamacao"
    },
    {
      "award": "European Film Awards",
      "status": "Anúncio dos Vencedores",
      "statusKey": "vencedores",
      "date": "17/01/2026",
      "dateISO": "2026-01-17",
      "timestamp": 1768608000000,
      "hasDate": true,
      "imageUrl": "https://i.imgur.com/nSvp7jP.png",
      "newsUrl": "",
      "pageUrl": "",
      "newsImageUrl": "",
      "newsTitle": "",
      "slug": "european-film-awards"
    },
    {
      "award": "Utah Film Critics Association Awards",
      "status": "Anúncio dos Vencedores",
      "statusKey": "vencedores",
      "date": "17/01/2026",
      "dateISO": "2026-01-17",
      "timestamp": 1768608000000,
      "hasDate": true,
      "imageUrl": "https://i.imgur.com/TesXUFj.png",
      "newsUrl": "",
      "pageUrl": "",
      "newsImageUrl": "",
      "newsTitle": "",
      "slug": "utah-film-critics-association-awards"
    },
    {
      "award": "Cinema Audio Society Awards",
      "status": "Anúncio dos Indicados",
      "statusKey": "indicados",
      "date": "20/01/2026",
      "dateISO": "2026-01-20",
      "timestamp": 1768867200000,
      "hasDate": true,
      "imageUrl": "https://i.imgur.com/eHK4wQT.png",
      "newsUrl": "",
      "pageUrl": "",
      "newsImageUrl": "",
      "newsTitle": "",
      "slug": "cinema-audio-society-awards"
    },
    {
      "award": "Houston Film Critics Society Awards",
      "status": "Anúncio dos Vencedores",
      "statusKey": "vencedores",
      "date": "20/01/2026",
      "dateISO": "2026-01-20",
      "timestamp": 1768867200000,
      "hasDate": true,
      "imageUrl": "https://i.imgur.com/DKTYUjB.png",
      "newsUrl": "",
      "pageUrl": "",
      "newsImageUrl": "",
      "newsTitle": "",
      "slug": "houston-film-critics-society-awards"
    },
    {
      "award": "Prêmio Exclamação",
      "status": "Anúncio dos Indicados",
      "statusKey": "indicados",
      "date": "21/01/2026",
      "dateISO": "2026-01-21",
      "timestamp": 1768953600000,
      "hasDate": true,
      "imageUrl": "https://i.imgur.com/pKC2eGl.png",
      "newsUrl": "",
      "pageUrl": "",
      "newsImageUrl": "",
      "newsTitle": "",
      "slug": "premio-exclamacao"
    },
    {
      "award": "Oscar",
      "status": "Anúncio dos Indicados",
      "statusKey": "indicados",
      "date": "22/01/2026",
      "dateISO": "2026-01-22",
      "timestamp": 1769040000000,
      "hasDate": true,
      "imageUrl": "https://i.imgur.com/guBEPZm.png",
      "newsUrl": "",
      "pageUrl": "",
      "newsImageUrl": "",
      "newsTitle": "",
      "slug": "oscar"
    },
    {
      "award": "Prêmio Exclamação",
      "status": "Início da Votação Aberta dos Vencedores",
      "statusKey": "vencedores",
      "date": "23/01/2026",
      "dateISO": "2026-01-23",
      "timestamp": 1769126400000,
      "hasDate": true,
      "imageUrl": "https://i.imgur.com/pKC2eGl.png",
      "newsUrl": "",
      "pageUrl": "",
      "newsImageUrl": "",
      "newsTitle": "",
      "slug": "premio-exclamacao"
    },
    {
      "award": "USC Scripter Awards",
      "status": "Anúncio dos Vencedores",
      "statusKey": "vencedores",
      "date": "24/01/2026",
      "dateISO": "2026-01-24",
      "timestamp": 1769212800000,
      "hasDate": true,
      "imageUrl": "https://i.imgur.com/EE9Ccfh.png",
      "newsUrl": "",
      "pageUrl": "",
      "newsImageUrl": "",
      "newsTitle": "",
      "slug": "usc-scripter-awards"
    },
    {
      "award": "North Carolina Film Critics Association Awards",
      "status": "Anúncio dos Vencedores",
      "statusKey": "vencedores",
      "date": "26/01/2026",
      "dateISO": "2026-01-26",
      "timestamp": 1769385600000,
      "hasDate": true,
      "imageUrl": "https://i.imgur.com/AhwwOGK.png",
      "newsUrl": "",
      "pageUrl": "",
      "newsImageUrl": "",
      "newsTitle": "",
      "slug": "north-carolina-film-critics-association-awards"
    },
    {
      "award": "Online Film Critics Society Awards",
      "status": "Anúncio dos Vencedores",
      "statusKey": "vencedores",
      "date": "26/01/2026",
      "dateISO": "2026-01-26",
      "timestamp": 1769385600000,
      "hasDate": true,
      "imageUrl": "https://i.imgur.com/ROCLSVN.png",
      "newsUrl": "",
      "pageUrl": "",
      "newsImageUrl": "",
      "newsTitle": "",
      "slug": "online-film-critics-society-awards"
    },
    {
      "award": "Ace Eddie Awards",
      "status": "Anúncio dos Indicados",
      "statusKey": "indicados",
      "date": "27/01/2026",
      "dateISO": "2026-01-27",
      "timestamp": 1769472000000,
      "hasDate": true,
      "imageUrl": "https://i.imgur.com/Yy5xZKv.png",
      "newsUrl": "",
      "pageUrl": "",
      "newsImageUrl": "",
      "newsTitle": "",
      "slug": "ace-eddie-awards"
    },
    {
      "award": "BAFTA",
      "status": "Anúncio dos Indicados",
      "statusKey": "indicados",
      "date": "27/01/2026",
      "dateISO": "2026-01-27",
      "timestamp": 1769472000000,
      "hasDate": true,
      "imageUrl": "https://i.imgur.com/HC5OPdJ.png",
      "newsUrl": "",
      "pageUrl": "",
      "newsImageUrl": "",
      "newsTitle": "",
      "slug": "bafta"
    },
    {
      "award": "Writers Guild of America Awards",
      "status": "Anúncio dos Indicados",
      "statusKey": "indicados",
      "date": "27/01/2026",
      "dateISO": "2026-01-27",
      "timestamp": 1769472000000,
      "hasDate": true,
      "imageUrl": "https://i.imgur.com/EgiPK2E.png",
      "newsUrl": "",
      "pageUrl": "",
      "newsImageUrl": "",
      "newsTitle": "",
      "slug": "writers-guild-of-america-awards"
    },
    {
      "award": "London Film Critics Circle Awards",
      "status": "Anúncio dos Vencedores",
      "statusKey": "vencedores",
      "date": "01/02/2026",
      "dateISO": "2026-02-01",
      "timestamp": 1769904000000,
      "hasDate": true,
      "imageUrl": "https://i.imgur.com/5BeeUOq.png",
      "newsUrl": "",
      "pageUrl": "",
      "newsImageUrl": "",
      "newsTitle": "",
      "slug": "london-film-critics-circle-awards"
    },
    {
      "award": "The Society of Composers and Lyricists Awards",
      "status": "Anúncio dos Vencedores",
      "statusKey": "vencedores",
      "date": "06/02/2026",
      "dateISO": "2026-02-06",
      "timestamp": 1770336000000,
      "hasDate": true,
      "imageUrl": "https://i.imgur.com/jr5IOlN.png",
      "newsUrl": "",
      "pageUrl": "",
      "newsImageUrl": "",
      "newsTitle": "",
      "slug": "the-society-of-composers-and-lyricists-awards"
    },
    {
      "award": "Directors Guild of America Awards",
      "status": "Anúncio dos Vencedores",
      "statusKey": "vencedores",
      "date": "07/02/2026",
      "dateISO": "2026-02-07",
      "timestamp": 1770422400000,
      "hasDate": true,
      "imageUrl": "https://i.imgur.com/FWn3YNA.png",
      "newsUrl": "",
      "pageUrl": "",
      "newsImageUrl": "",
      "newsTitle": "",
      "slug": "directors-guild-of-america-awards"
    },
    {
      "award": "Costume Designers Guild Awards",
      "status": "Anúncio dos Vencedores",
      "statusKey": "vencedores",
      "date": "12/02/2026",
      "dateISO": "2026-02-12",
      "timestamp": 1770854400000,
      "hasDate": true,
      "imageUrl": "https://i.imgur.com/goLNvdg.png",
      "newsUrl": "",
      "pageUrl": "",
      "newsImageUrl": "",
      "newsTitle": "",
      "slug": "costume-designers-guild-awards"
    },
    {
      "award": "Independent Spirit Awards",
      "status": "Anúncio dos Vencedores",
      "statusKey": "vencedores",
      "date": "15/02/2026",
      "dateISO": "2026-02-15",
      "timestamp": 1771113600000,
      "hasDate": true,
      "imageUrl": "https://i.imgur.com/dxiMIY3.png",
      "newsUrl": "",
      "pageUrl": "",
      "newsImageUrl": "",
      "newsTitle": "",
      "slug": "independent-spirit-awards"
    },
    {
      "award": "Make-Up Artists and Hair Stylist Guild Awards",
      "status": "Anúncio dos Vencedores",
      "statusKey": "vencedores",
      "date": "15/02/2026",
      "dateISO": "2026-02-15",
      "timestamp": 1771113600000,
      "hasDate": true,
      "imageUrl": "https://i.imgur.com/KoFaxBl.png",
      "newsUrl": "",
      "pageUrl": "",
      "newsImageUrl": "",
      "newsTitle": "",
      "slug": "make-up-artists-and-hair-stylist-guild-awards"
    },
    {
      "award": "Annie Awards",
      "status": "Anúncio dos Vencedores",
      "statusKey": "vencedores",
      "date": "21/02/2026",
      "dateISO": "2026-02-21",
      "timestamp": 1771632000000,
      "hasDate": true,
      "imageUrl": "https://i.imgur.com/3AzDQVF.png",
      "newsUrl": "",
      "pageUrl": "",
      "newsImageUrl": "",
      "newsTitle": "",
      "slug": "annie-awards"
    },
    {
      "award": "BAFTA",
      "status": "Anúncio dos Vencedores",
      "statusKey": "vencedores",
      "date": "22/02/2026",
      "dateISO": "2026-02-22",
      "timestamp": 1771718400000,
      "hasDate": true,
      "imageUrl": "https://i.imgur.com/HC5OPdJ.png",
      "newsUrl": "",
      "pageUrl": "",
      "newsImageUrl": "",
      "newsTitle": "",
      "slug": "bafta"
    },
    {
      "award": "Visual Effects Society Awards",
      "status": "Anúncio dos Vencedores",
      "statusKey": "vencedores",
      "date": "25/02/2026",
      "dateISO": "2026-02-25",
      "timestamp": 1771977600000,
      "hasDate": true,
      "imageUrl": "https://i.imgur.com/rmzHXXg.png",
      "newsUrl": "",
      "pageUrl": "",
      "newsImageUrl": "",
      "newsTitle": "",
      "slug": "visual-effects-society-awards"
    },
    {
      "award": "Artios Awards (Casting Society)",
      "status": "Anúncio dos Vencedores",
      "statusKey": "vencedores",
      "date": "26/02/2026",
      "dateISO": "2026-02-26",
      "timestamp": 1772064000000,
      "hasDate": true,
      "imageUrl": "https://i.imgur.com/UbvehH5.png",
      "newsUrl": "",
      "pageUrl": "",
      "newsImageUrl": "",
      "newsTitle": "",
      "slug": "artios-awards-casting-society"
    },
    {
      "award": "Oscar",
      "status": "Início da Votação da Academia para os Vencedores",
      "statusKey": "vencedores",
      "date": "26/02/2026",
      "dateISO": "2026-02-26",
      "timestamp": 1772064000000,
      "hasDate": true,
      "imageUrl": "https://i.imgur.com/guBEPZm.png",
      "newsUrl": "",
      "pageUrl": "",
      "newsImageUrl": "",
      "newsTitle": "",
      "slug": "oscar"
    },
    {
      "award": "Ace Eddie Awards",
      "status": "Anúncio dos Vencedores",
      "statusKey": "vencedores",
      "date": "27/02/2026",
      "dateISO": "2026-02-27",
      "timestamp": 1772150400000,
      "hasDate": true,
      "imageUrl": "https://i.imgur.com/Yy5xZKv.png",
      "newsUrl": "",
      "pageUrl": "",
      "newsImageUrl": "",
      "newsTitle": "",
      "slug": "ace-eddie-awards"
    },
    {
      "award": "Art Directors Guild Awards",
      "status": "Anúncio dos Vencedores",
      "statusKey": "vencedores",
      "date": "28/02/2026",
      "dateISO": "2026-02-28",
      "timestamp": 1772236800000,
      "hasDate": true,
      "imageUrl": "https://i.imgur.com/6Q2pQGV.png",
      "newsUrl": "",
      "pageUrl": "",
      "newsImageUrl": "",
      "newsTitle": "",
      "slug": "art-directors-guild-awards"
    },
    {
      "award": "Producers Guild of America Awards",
      "status": "Anúncio dos Vencedores",
      "statusKey": "vencedores",
      "date": "28/02/2026",
      "dateISO": "2026-02-28",
      "timestamp": 1772236800000,
      "hasDate": true,
      "imageUrl": "https://i.imgur.com/S8SzYV8.png",
      "newsUrl": "",
      "pageUrl": "",
      "newsImageUrl": "",
      "newsTitle": "",
      "slug": "producers-guild-of-america-awards"
    },
    {
      "award": "The Actor Awards",
      "status": "Anúncio dos Vencedores",
      "statusKey": "vencedores",
      "date": "01/03/2026",
      "dateISO": "2026-03-01",
      "timestamp": 1772323200000,
      "hasDate": true,
      "imageUrl": "https://i.imgur.com/7XfcN3n.png",
      "newsUrl": "",
      "pageUrl": "",
      "newsImageUrl": "",
      "newsTitle": "",
      "slug": "the-actor-awards"
    },
    {
      "award": "GALECA: The Society of LGBTQ Entertainment Critics Awards",
      "status": "Anúncio dos Indicados",
      "statusKey": "indicados",
      "date": "03/03/2026",
      "dateISO": "2026-03-03",
      "timestamp": 1772496000000,
      "hasDate": true,
      "imageUrl": "https://i.imgur.com/KtzeFFw.png",
      "newsUrl": "",
      "pageUrl": "",
      "newsImageUrl": "",
      "newsTitle": "",
      "slug": "galeca-the-society-of-lgbtq-entertainment-critics-awards"
    },
    {
      "award": "Oscar",
      "status": "Fim da Votação da Academia para os Vencedores",
      "statusKey": "vencedores",
      "date": "05/03/2026",
      "dateISO": "2026-03-05",
      "timestamp": 1772668800000,
      "hasDate": true,
      "imageUrl": "https://i.imgur.com/guBEPZm.png",
      "newsUrl": "",
      "pageUrl": "",
      "newsImageUrl": "",
      "newsTitle": "",
      "slug": "oscar"
    },
    {
      "award": "Cinema Audio Society Awards",
